title,comments,age,thread
funkadelic maggot brain,16,841.2204169829688,rock
motorhead motorhead live germany,0,289.603750316302,rock
bands prefer,5,125.553750316302,rock
anyone special affinity towards lengthier songs,12,654.9870836496352,rock
jebediah jerks attention,0,181.8370836496353,rock
debut single,0,187.82041698296862,rock
guys south call,0,25.553750316301986,rock
bridget bananas,0,34.47041698296865,rock
gorillaz feel good inc cover yung hade,0,41.853750316301976,rock
young david bowie receives letter idol little richard rebel rebel comics biography david bowie episode,0,836.6204169829688,rock
symphony dead lights go,0,114.50375031630196,rock
best new post hardcore band,0,149.17041698296862,rock
haim expect women music pt iii,0,199.12041698296864,rock
scum shots wetbrain nyc scum punk,0,201.53708364963526,rock
hey friends thought might interested subreddit r actualhippies place dedicated spirituality art music psychedelia hippie culture nature etc,0,244.22041698296863,rock
black sabbath thrill,3,1606.2204169829683,rock
redline summer nights,0,327.6370836496353,rock
dream feed touch flame lyric video,0,365.4704169829686,rock
time favorite metallica song r p cliff,0,595.6204169829688,rock
band maid choose live tokyo line cube shibuya,0,601.6537503163021,rock
utopist drowned progressive modern post rock,0,416.153750316302,rock
trippy guitars vocal harmonies,0,500.5370836496353,rock
fulcrum must dream rock alt,0,510.57041698296877,rock
wanna start band,0,518.953750316302,rock
cutlery never know strong strong choice,0,643.1370836496352,rock
dad released album recently would love could give support,0,1371.0204169829688,rock
know name song,0,920.2204169829688,rock
gigantic hypermania,0,698.9870836496353,rock
green day whatsername isolation cover,0,796.3870836496353,rock
killer cover bruce springsteen,3,1043.7870836496354,rock
mi ami steal face full album,0,962.9037503163021,rock
pub rock song famous australia think people enjoy lot please listen,2,2269.6870836496355,rock
clarissa butterfly,0,1368.7870836496354,rock
time leaving hope understand,0,1953.9870836496352,rock
providence truth reconciliation,0,1522.2537503163019,rock
need live aid ever,0,1327.0370836496354,rock
people reddit need help,0,1342.5704169829687,rock
u streets name official video,6,2632.1204169829684,rock
best guitarist,0,1378.3037503163018,rock
give top rock songs time,4,1443.0204169829688,rock
reminiscent kurt cobain rock,3,1984.6704169829688,rock
top rock albums,3,1462.903750316302,rock
pick best rock band,7,1648.453750316302,rock
red alone,0,1660.3204169829687,rock
strawhorse fishbowl,0,1733.9870836496352,rock
interview jeff keith tesla rock hard jay conroy show,0,1788.2870836496356,rock
finals right,0,2039.5704169829687,rock
choose top rock vocalist,73,3210.8870836496358,rock
otoboke beaver il vous plait,4,2082.853750316302,rock
best bands progressive rock,3,1957.7704169829688,rock
new sons silver interview rock hard jay conroy,0,1985.8704169829687,rock
must know facts queen hit song champions,0,1998.9870836496352,rock
hey everyone need mixing mastering done happy work discuss budget however want track sound information work back forth happy sound mixes worked soundcloud page,0,2076.603750316302,rock
soundgarden searching good eye closed,1,3098.6370836496358,rock
cool vocalist closest axl rose,2,2170.3870836496358,rock
fury slaughterhouse radio orchid,1,2170.4370836496355,rock
boys night first time taste like blood,0,2183.6704169829686,rock
ted nugent stranglehold official audio,0,2234.587083649635,rock
track rocks hard,0,2499.953750316302,rock
generation x ready steady go,1,3103.703750316302,rock
whats name jeff beck song,3,3414.0704169829687,rock
scandal tonight darklight prodigy cover,0,2452.853750316302,rock
hero drum cover taylor hawkins version,0,2751.303750316302,rock
new instrumental rock ep nakama,0,2842.1870836496355,rock
muddy ruckus footprints,0,2689.2870836496354,rock
rawk,0,2754.7704169829685,rock
believe best guitar solo played ever david fucking legend,11,4336.903750316302,rock
nero rome pulling low,0,2863.7704169829685,rock
spirit machines watch burn lyric video,0,2865.487083649635,rock
cachorro grande lp,0,2999.370416982969,rock
hotel year best part,0,3012.4037503163017,rock
trippy canterbury,0,3361.9370836496355,rock
steely dirty work steely dan quarantine cover,0,3401.703750316302,rock
gimme shelter andrew appletree hommage,0,3266.737083649635,rock
gimme shelter andrew appletree hommage,0,3290.6704169829686,rock
best thing recorded iphone instagram live,0,3331.937100315094,rock
archers loaf eric bachmann sing character hates commerce walmart real part personality,0,3380.120433648428,rock
mood loud music choose band,34,4697.587100315094,rock
eyes beast within,0,3457.537100315094,rock
camelio antagonist norway quarantine video,0,3684.987100315094,rock
red bacteria vacuum free soul hopping kid baby blue live minutes,0,3515.653766981761,rock
mest misunderstood,0,3544.5037669817607,rock
new rock release letting go something held long,0,3573.220433648428,rock
allan holdsworth peak,0,3601.903766981761,rock
chout wrecks singer sounds eerily similar layne staley curious people think friends band also new single,0,4010.270433648427,rock
top bands right,85,5176.25376698176,rock
clockwork angels true swan song album rush album analysis,0,4246.620433648427,rock
best vinyl lp listen start finish vinyl listening experience required,3,4026.8204336484273,rock
tappy mctapface,0,4064.0037669817607,rock
danzig cant speak,0,4148.287100315094,rock
soapbox,0,4391.787100315094,rock
superchunk sunshine state,0,4173.470433648427,rock
songs similar mayday libertines,0,4464.437100315094,rock
infractal su majestad,0,4288.937100315094,rock
queen going slightly mad,5,5363.903766981761,rock
dead kennedys let lynch landlord,1,5236.270433648428,rock
tell honest opinions,0,4387.587100315094,rock
blue oyster cult fear reaper live,2,4734.570433648428,rock
hey band germany released new single days ago appreciate feedback conclusion age empire clouds,1,4780.703766981761,rock
hope u enjoy one,0,4585.00376698176,rock
billy idol blue highway,3,5647.6037669817615,rock
run hounds full performance kuci crazy performance anyone missing live music right,0,4620.203766981761,rock
choose one band listen quarantine,19,5723.537100315094,rock
prefer version original better produced symphonic,0,4730.05376698176,rock
little richard life inspires david bowie rebel rebel graphic novel biography david bowie episode,0,4733.953766981761,rock
witch lazy bones,0,4746.103766981761,rock
dream theater glass prison,2,5546.55376698176,rock
angry chair alice chains,2,6204.30376698176,rock
need discovered,0,4945.30376698176,rock
paranoid void redo,0,4953.50376698176,rock
zz top sure got cold rain fell rio grande mud,1,5254.55376698176,rock
everyday sunday gypsy girl love,0,5037.637100315094,rock
running monday tuesday,0,5072.453766981761,rock
anyone interested bosnian rock sounded like,0,5604.537100315094,rock
soundgarden loud love,2,6875.487100315094,rock
hundred reasons stories unhappy endings,0,5647.987100315094,rock
favorite grunge band,18,6429.520433648428,rock
welcome jungle cover,4,6139.087100315094,rock
south jersey band thunderworm nd ep cardinal black,0,5785.320433648428,rock
moonrage mutilate,0,5817.1037669817615,rock
trippy keyboards,2,6648.037100315094,rock
nthngfvce,0,5854.00376698176,rock
hawkwind motorhead,2,6690.037100315094,rock
roy orbison drove night,1,6686.4704336484265,rock
speedtrap eyes conquest simple honest finnish band records would play post atomic party,0,6219.637100315094,rock
ramones blitzkrieg bop guitar vocal cover yoni saffra,0,6019.320433648428,rock
machine head darkness within,0,6447.887100315094,rock
proto proto punk jim morrison ranting front thousands people,12,7312.787100315094,rock
snatch snail glowing green,0,6244.6037669817615,rock
great combination jazz rock,3,6248.837100315094,rock
sun shining jj grey mofro,0,6368.703766981762,rock
pete pardo army,1,6604.403766981762,rock
palettepalettes non conforming person,0,6398.437100315094,rock
songs similar let dance david bowie,2,6795.903766981762,rock
god god life,0,6478.00376698176,rock
sisters mercy lucretia reflection,1,8070.187100315094,rock
improvisation recorded recently,0,7099.553766981759,rock
blackberry smoke midnight rider live capricorn sound studios,0,7567.420433648426,rock
bloom demons new single south african rock band,3,7688.670433648426,rock
copperpot leaving,0,7197.703766981762,rock
pink floyd wish rhythm lead acoustic strings guitar,2,7217.920433648426,rock
greatest songs nirvana indigo music,0,8299.520433648428,rock
bush gavin rossdale loneliness self improvement,1,7350.787100315094,rock
otoboke beaver light fire punk rock,0,7806.953766981762,rock
falling reverse chemical prisoner,0,7467.003766981759,rock
live inside often know,0,7711.187100315094,rock
paul mccartney calls china close medieval wet markets,1,8904.187100315094,rock
whatever feels right grove st,0,7776.270433648428,rock
santana guitar vocals collab cover quarantine jam,0,7619.920433648426,rock
big dirty dirty rider,0,7854.003766981759,rock
drum cover incubus circles,0,8400.753766981761,rock
hellacopters grace god hi bros know swedish group year long career year split punk garage influences love,2,7973.670433648426,rock
child thrive grow enter world liars cheaters people like smile think know,4,7979.887100315094,rock
walking across jupiter friend feat vitaly machunsky single bandlink hope clear helping hand difficult moment life crucial never together stronger together fight survival lives,0,7996.070433648428,rock
bowie ambition years old little richard saxophonist rebel rebel episode,0,8016.253766981759,rock
black sabbath god dead official video,2,9454.903766981759,rock
offspring early heavy metal sludgiest grunge today best hard rock effortlessly combining bone crushing riffs melodic hooks robots forms one unique sounds rock music today fans soundgarden sabbath zeppelin etc,0,8242.170433648427,rock
band recommendations read,8,8665.153766981759,rock
eric clapton fathers eyes live,0,8822.620433648428,rock
discord online jamming central online jamming community musicians,0,8490.053766981759,rock
emerald dream acheron galaxy fans hard rock,0,8569.420433648427,rock
kansas silhouettes disguise,0,8701.137100315094,rock
cover nirvana lithium shane,0,8747.653766981759,rock
world indeed stage merely players performers portrayers,3,9085.237100315097,rock
pretty cool song think many people know one,4,9311.670433648427,rock
usual post,22,8883.853766981762,rock
heaven hell black sabbath,8,10404.903766981759,rock
henry villaruel drop addy,0,8981.170433648427,rock
expert expert choking smokers think joker laughs,0,9002.870433648428,rock
new rock song released artist sweden slaps,0,9641.070433648427,rock
siriusxm home dj series continues octane channel today,0,9227.737100315097,rock
bruce springsteen trapped,0,9794.537100315094,rock
superfly force,0,9272.970433648426,rock
decade better,2,9743.670433648427,rock
ever thought amount music creativity never got see develop due hendrix young death,2,10208.387100315094,rock
favourite nirvana song,92,10851.687100315094,rock
forget forget nothing important,2,9691.120433648428,rock
new original rock song hope enjoy,0,10422.653766981759,rock
helloo,0,9821.353766981762,rock
best imagine dragons song,11,10752.337100315091,rock
new blxxd ride away,0,10102.887100315094,rock
covered live strokes drums,0,10213.720433648426,rock
type negative summer breeze,4,11102.070433648427,rock
cards saxon paul quinn side project sweet lowdown dirty love,0,10553.803766981759,rock
tricot great reflection festival live full length video available may indie rock,0,10559.820433648427,rock
kevin cronin reo speedwagon plays time fly,1,10731.403766981759,rock
type oof rock better,42,11694.637100315094,rock
country joe fish death sound blues,0,10769.670433648427,rock
tricot years live full length video available may indie rock,0,10559.220433648426,rock
erkin koray hor g rme garibi turkish rock english subtitles,0,10607.953766981758,rock
bands suggestions,7,10897.053766981759,rock
noodles blood waltz,0,10718.687100315094,rock
like soundgarden tool led zeppelin might like tune band,47,12184.787100315096,rock
warstories complicated new band tx inspired late alt rock,1,11334.337100315093,rock
li fantasy destructive force punk rock band vancouver,0,10995.70376698176,rock
rashit feat teoman yak n l deneyimi cover,0,11033.120433648428,rock
like bands like foo fighters nine inch nails maybe try track bands first album,0,11566.537100315096,rock
rem upset like experimental rock sounds like nothing nowhere mayday parade love guys,0,11160.137100315094,rock
sun way deep live quarantine sessions,0,11173.80376698176,rock
pop rock ballad lovers check,0,11192.95376698176,rock
beatles unveil unheard treasure trove years let,0,11748.287100315096,rock
vigilante ride wind rock guitar shredding,0,11310.720433648425,rock
personal favorite albums time,12,11386.237100315095,rock
drum cover middle video lmk need drummer recordings,0,11437.770433648428,rock
danzig tired alive,0,12211.270433648428,rock
made back october last year like rap rock nu metal alright,0,11809.387100315094,rock
,21,13135.837100315093,rock
picked guitar first time ten years rocked hell,3,11727.45376698176,rock
like green day joan jett fratellis might like band newest single check,2,11744.170433648427,rock
tunca welcome back funk rock,0,11758.420433648427,rock
april april years iron maiden phantom opera,1,12306.503766981761,rock
fan ac dc rolling stones nirvana might like song band,0,11944.95376698176,rock
hey guys kind music song personally receive miserable sad desperate feeling song would really apreciate opinions thoughts,3,11973.737100315095,rock
years death peter steele type negative electrocute,0,12045.687100315095,rock
nihonmadonna slave society,0,12158.353766981763,rock
wytch hazel save life uk,0,12240.40376698176,rock
made first song today inspired teen suicide american pleasure club sadboi confessional emo rock type stuff,1,12322.253766981761,rock
heavy rock grunge metal band auckland new zealand close bone sink preview,1,12762.05376698176,rock
looking start equivalent book club albums,54,13873.370433648428,rock
dad playing ever seen rain way brazil definetly english speaker,0,13082.15376698176,rock
nfo hope like,0,12909.220433648425,rock
modest mouse dark center universe album moon antarctica,0,12694.137100315094,rock
ali azmat shukriya klashinfolk,0,13272.487100315095,rock
soundgarden ugly truth,1,13183.087100315093,rock
looking bands want music vr air guitar game,2,13358.570433648427,rock
clash straight hell,6,14527.45376698176,rock
suggestions roots rock kinda stuff,4,13279.720433648425,rock
drug use rock music,1,13555.070433648427,rock
u mysterious ways official music video,0,13644.737100315095,rock
h llas star rider adventure rock,0,13913.70376698176,rock
need cool new rock bands,6,13555.787100315096,rock
tricklebolt backbite official video,0,13588.037100315096,rock
mutant monster abnormal,0,13599.487100315095,rock
foo fighters breakout guitar cover,0,13667.970433648425,rock
pixies head carrier,0,14250.353766981763,rock
three days grace gone forever,0,14795.037100315096,rock
songs called wolves,2,14150.020433648428,rock
idle hands way kingdom heavy metal gothic rock,0,13992.620433648428,rock
coronavirus sucks given time finally make music bubble gum baby,4,15165.237100315095,rock
help get,0,14211.870433648428,rock
greatest hard rock guitarist bar none,0,14489.70376698176,rock
sr cartucho cuando se complica,0,14282.237100315095,rock
sr cartucho sin permiso,0,14307.070433648427,rock
god god enough,2,15134.020433648428,rock
add music collaborative playlist,3,14713.170433648427,rock
song heavier helter skelter beatles,31,16013.753766981761,rock
goons homerun,0,14848.55376698176,rock
late november special,0,15214.320433648427,rock
mac glass air,0,14905.30376698176,rock
mikkaitomiminari woman wants held man wants hug punk rock,2,15029.353766981763,rock
tom sawyer rush,0,15063.237100315095,rock
drum cover arctic monkeys arabella,0,15705.087100315093,rock
beginning verse boys summer henley really depicts everything going quarantine,0,15972.253766981761,rock
redhook dead walk darklight prodigy cover,0,16146.437100315095,rock
space rocket garage band fixing wee bits,0,16226.520433648428,rock
sexy rock,18,17627.30376698176,rock
killing joke eighties,4,16852.837100315093,rock
monkey mond zoo riot,0,15797.253766981761,rock
takatak faultllines song pakistani band,0,15799.853766981763,rock
kaleo alter ego,0,16217.370433648428,rock
complete creation burial track exit exist latest albumevergreen cheggit,0,16135.137100315094,rock
nine inch nails last,0,16098.103766981763,rock
hear,0,16404.10376698176,rock
italian psych jazz rock stoner unit otakusuite proudly present debut album eggs,0,16682.787100315094,rock
mary blood marionette,0,16481.087100315093,rock
best year music,1,16628.837100315093,rock
prefer,17,18036.870433648422,rock
hour live rock stream,0,17335.970433648432,rock
recommendations,10,17948.270433648428,rock
bleach tomorrow,0,17180.337100315093,rock
please take second vote stereo pharaoh rock hip hop music label contest,0,17489.337100315093,rock
chester numbing bennington,0,17306.637100315093,rock
gran cavallo matter rock blues rock,0,17537.453766981762,rock
clay people awake,0,17317.15376698176,rock
live rock stream,0,17338.35376698176,rock
pearl jam european tour postponed,0,17720.15376698176,rock
signsedso cold call,0,17389.287100315094,rock
aflos wasting time,0,17413.620433648426,rock
smashing pumpkins guitar cover,0,17997.937100315095,rock
new strokes new abnormal,0,18567.970433648432,rock
henry villaruel hot n heavy,0,17484.80376698176,rock
ringo jets full stash official video,0,17725.15376698176,rock
sparta importance therapy positivity,0,17534.370433648426,rock
eye tiger major key,0,17660.637100315093,rock
earth andy smoke ring,0,17933.787100315094,rock
music,0,17738.40376698176,rock
valid point,4,19522.35376698176,rock
new album local h lifers,0,17851.320433648427,rock
monty carlos never,0,17900.953766981762,rock
lovebites destinies align,0,17918.60376698176,rock
five minute march pussy rock,0,18160.887100315093,rock
new,6,18736.387100315093,rock
tunca di er taraf indie rock,0,18161.73710031509,rock
strokes considered one greatest rock bands time,5,18260.80376698176,rock
pink floyd grateful dead release unseen rare footage youtube amid covid lockdown,0,18945.620433648422,rock
flight calico misplaced motivation,0,18694.837100315093,rock
aaxiom hey go f coronavirus,0,18345.98710031509,rock
special late november,0,18514.92043364843,rock
led zeppelin top songs tier list drums stats,0,19154.337100315093,rock
name song challenge radiohead,0,18856.470433648432,rock
asking,2,18945.43710031509,rock
mac glass show em,0,18847.320433648427,rock
creeper lagoon kisses pills,0,18926.43710031509,rock
bowie spins first little richard record rebel rebel comics biography david bowie episode,0,19279.43710031509,rock
fear dark,0,19132.520433648428,rock
anyone else get rock songs triggered brain lot,26,20422.67043364843,rock
screaming trees onstage meltdown,0,19180.637100315093,rock
katatonia behind blood new album city burials think,0,19263.087100315093,rock
kyojaku philosophical refutation,0,19362.203766981762,rock
dropped single last week check,0,20037.15376698176,rock
sang man sold world best,6,20150.820433648427,rock
thank scientist fxmldr,0,19561.370433648422,rock
need rock metal heavy loud bass heard equally much guitar,21,20617.470433648432,rock
heart murmur live home edit seattle april new songs,0,19844.75376698176,rock
good ole tunes,0,19902.05376698176,rock
naht place heart japan,0,20168.43710031509,rock
cool black kettle free,0,20038.93710031509,rock
spin revisits guns n roses use illusion tour,4,20385.00376698176,rock
nirvana man sold world,6,21757.453766981762,rock
perfect circle hollow,2,21258.220433648432,rock
afterglow ephemeral,0,20214.75376698176,rock
creed interview practice,0,20475.887100315093,rock
pentacle head warp case,0,20516.070433648427,rock
need good workout music quick tracks popular bands listen,7,20570.570433648427,rock
blue yster cult summer love,2,21845.90376698176,rock
rock bands,5,20643.00376698176,rock
believe thing called love quarantine cover,0,20762.287100315094,rock
kelly line father son songwriting duo,0,20800.887100315093,rock
kaneyorimasaru tomorrow night rock pop indie,0,20803.42043364843,rock
warp woof paperback gatsby,0,20889.587100315093,rock
young rock roll band big sound,0,21621.17043364843,rock
radiohead creep piano cover,0,20996.587100315093,rock
far east asian tigers myeonmok middle school korean punk rock,0,21372.73710031509,rock
made ultimate dad rock cock rock butt rock playlist hide dads,0,21288.320433648427,rock
analyzing alice chains song decision layne staley,0,21925.820433648427,rock
peter gural dog takes nap alternative,0,21360.587100315093,rock
billy amazing rythm lead guitars,0,22025.93710031509,rock
lovebites summer sonic live heavy metal stay watch available hours,0,21412.087100315093,rock
regret life moment japan,0,21482.48710031509,rock
band dead engine new album give listen,11,22641.770433648428,rock
payday social haunts,0,21644.637100315093,rock
shadow death bonfire dreams,0,21912.220433648432,rock
martes acustico bob dylan unplugged,0,21689.087100315093,rock
dwellings lemonade,0,21700.287100315094,rock
shelter people darling girl smokestack lighting single,0,21808.92043364843,rock
new video stuff iron rain,0,21948.587100315093,rock
new rock show melting pot open tempo fm unsigned artist bunch old stuff manics candlebox pearl jam charlatans free free fire water full album played end constructive criticism welcome try talk much tracks ruined enjoy,0,22221.65376698176,rock
jump lights lapis lazuli depression,0,22250.620433648422,rock
mind ripple shadow aspect alternative rock,0,22049.920433648433,rock
foo fighters stick around guitar cover,0,22052.303766981757,rock
drohi abar ronge official audio alternative rock duo usa bangladesh,0,22073.920433648433,rock
band wake f also looking film bands like hit us want work together know someone,0,22202.770433648428,rock
cess radical junior sure sub genre rock little bluesy drum machine metal tones synths really like someone help giving genre tag also lemme know think currently one man band need feedback,0,22252.68710031509,rock
band maid live summer sonic hard rock replay stay watch roll available hours,8,22816.087100315093,rock
adair diamond ring,0,22327.670433648433,rock
new rock song check c low lands,6,23475.170433648433,rock
cigarette daydreams hour rock playlist,1,22382.920433648433,rock
mads wolfe thief folk rock,0,22643.43710031509,rock
metallica cure relevant,0,22945.320433648427,rock
highly suspect upperdrugs,0,23197.387100315093,rock
social haunts trash art,0,23840.20376698176,rock
northern slow japan,0,23009.820433648427,rock
bowie obsession little richard begins rebel rebel comics biography david bowie episode,0,23732.15376698176,rock
zastranienie shining behind scenes,0,23651.787100315094,rock
chicken caravan deluxe otakusuite,0,23913.637100315093,rock
patti smith dancing barefoot,0,24483.620433648422,rock
fire radio vacant states,0,23370.020433648428,rock
caustic mins mask embarrassment friends punky rock band berlin playing tunes stuck flats,0,23373.353766981756,rock
favorite albums,9,24212.570433648427,rock
candlemass prophecy dark reflections epic doom metal,0,23987.470433648432,rock
mushroom field official video pattern addict,1,23422.853766981756,rock
right stereo pharaoh,1,23426.003766981758,rock
kings leon crawl,0,24487.170433648433,rock
weathered stranger,0,23685.95376698176,rock
loving new living dead stars track,0,23504.68710031509,rock
radiohead ed brien inspired foals,0,23568.40376698176,rock
umpfh sjabbalabba,0,23575.93710031509,rock
found song thought sounded really good alternative rock loved vocals underrated,0,23666.503766981758,rock
hump back haikei sh nen,0,23670.420433648433,rock
real quadrophenia hard rock,0,24542.70376698176,rock
temple dog saviour,0,24912.93710031509,rock
christopher cross sailing,2,24665.220433648432,rock
bodies beach ghost alternative arts live warehouse groovy song great lyrics,1,24035.970433648432,rock
buckethead liquid mantis,0,24316.43710031509,rock
stars go cold last dying breed,0,24474.70376698176,rock
nirvana girl,8,25685.23710031509,rock
lost time need anyone japan,0,24550.920433648433,rock
young fiction killing kindness,0,24637.503766981758,rock
recognizer faces,0,25213.770433648428,rock
billy flea vs bass grooving symtoms,0,24824.620433648422,rock
recommend songs,5,24837.803766981757,rock
best badass one liners rock songs,11,25305.570433648427,rock
standout lyrics assignment,5,25386.887100315093,rock
soundgarden beyond wheel live,0,25565.820433648427,rock
loudness crazy nights,0,25935.68710031509,rock
nice playlist chill,0,25285.65376698176,rock
rock essentials,8,25666.90376698176,rock
greed five egg virgin suicides,0,25127.370433648422,rock
pain salvation flesh,0,25385.870433648422,rock
stoneroad covid rock,0,25160.670433648433,rock
best rock albums,1,25180.337100315093,rock
edgar winter group free ride,0,25789.20376698176,rock
strictly drinking glooming purposes,0,25284.95376698176,rock
green day fan one man band cover green day j r,3,25745.65376698176,rock
kingsize miss america,0,25758.087100315093,rock
pre ac dc brian johnson shows us keeps flat cap god damn amazing voice always,8,26710.387100315093,rock
anthony green fine,1,26120.820433648427,rock
la reina emmanuel danann,0,25767.98710031509,rock
yep billy,0,25844.387100315093,rock
faake taxi driver killed moana pozzi garage rock,0,25845.537100315094,rock
yea billy really fera everything,0,25857.820433648427,rock
larusso motion,0,25866.120433648422,rock
yep bhttps youtu ibyhz eilly fera max,0,25904.120433648422,rock
gypsy shoed skinshell curtain blues ely james backtrakkers,0,26134.053766981757,rock
