title,comments,age,thread
bowie first live performance aged rebel rebel comics biography david bowie episode,0,26407.570433648427,rock
carson coma cringe days hungarian band playing vintage indie rock majority songs english ranging style jazzy chill ballad kind organ filled punk ish rock strange definitely rock hope guys enjoy,3,26505.65376698176,rock
hello south korea like sound american rock music recommendation songs listen,112,27727.337100315093,rock
rock bands full trunk paz band finished arrange nearly playlist spotify sound similarity order offers blending different genres performed israeli artists succeeded beyond borders take look,0,26323.870433648422,rock
new red album,1,26434.303766981757,rock
half century honor student go go nana ni san ni rei alternative rock,0,26559.587100315093,rock
blanket,0,26638.670433648433,rock
god god dream,0,26640.520433648428,rock
good rock bands,2,26652.837100315093,rock
macs daddy ocd,0,26877.43710031509,rock
macs daddy ocd,0,26877.90376698176,rock
dio rainbow dark music video,6,28112.770433648428,rock
dont cry gnr crazy cover,0,27329.253766981758,rock
first signs frost meat week,0,27169.420433648433,rock
put together rock roll classics,0,27462.087100315093,rock
still life projector lesson,0,27479.670433648433,rock
mess,0,27551.003766981758,rock
someone know talking visuals,0,27608.103766981756,rock
new rock bands listening,69,28864.287100315094,rock
thiny lizzy suicide,0,28108.087100315093,rock
red hot chilli peppers vs pearl jam better band,6,28091.087100315093,rock
new rock roll magazine first article hungary best communist era blues group,0,27975.93710031509,rock
billy mays band introspection,0,28030.73710031509,rock
kurt cobain lead singer weezer,1,27865.320433648427,rock
automatic heart attack automatic heart attack clean boy indie shtuff wyoming,0,27937.603766981756,rock
experienced diamond force time machine fresh rock,0,27989.95376698176,rock
flip bat boy bat girl live,0,27990.553766981757,rock
danzig mother,2,29446.370433648422,rock
flute solo experiments new mind reverse album brazil,0,28105.820433648427,rock
british american music,6,28466.870433648422,rock
dwindle second opinion,0,28113.353766981756,rock
wrote rock song called vikings heavily inspired tv show,0,28136.73710031509,rock
solid rock playlist give listen might like,0,28562.220433648432,rock
favorite lp,0,28937.637100315093,rock
walking heads tv boy ii full lp,0,29022.23710031509,rock
tom petty heartbreakers american girl last song tom petty played live passed away week later,0,29422.770433648428,rock
fever justin vreeland classic rock,0,28918.00376698176,rock
tool pot,6,30425.337100315093,rock
collection heavy punk rock music,0,29002.770433648428,rock
link wray rumble best link wray,0,29337.95376698176,rock
great even,0,29158.403766981763,rock
puddle mudd psycho,0,29189.68710031509,rock
aldious dominator metal,0,29414.120433648422,rock
primus tommy cat,1,30338.387100315093,rock
ride live brixton academy london th march full set,0,29714.70376698176,rock
lucie lucky,0,30882.48710031509,rock
ride pitchfork music festival full set,0,29845.137100315093,rock
avenged sevenfold beast harlot,1,30218.93710031509,rock
lammping forest trees psych stoner,0,29987.720433648432,rock
hi want introduce argentinian rock,0,30221.787100315094,rock
beyonc marshmello top charts stars join youtube covid campaign,1,30467.020433648428,rock
gary clark jr land,1,30571.403766981763,rock
casket lottery air,0,30291.220433648432,rock
mix cher like jesse james rare original video,0,30327.48710031509,rock
mix cry little sister lost boys soundtrack lyrics description,0,30329.20376698176,rock
keys corridors exchange,0,30330.95376698176,rock
mix marc broussard arms mine otis redding cover,0,30331.670433648433,rock
peroxide blonde world mine,0,30340.23710031509,rock
europe carrie,0,31210.48710031509,rock
rebel rebel weekly webcomic biography david bowie researched created past four years con chrisoulis read initial episodes webtoon,0,31244.153766981763,rock
dua lipa break heart tonytcover enjoy sub,0,30825.020433648428,rock
brandtson friends like,0,30968.75376698176,rock
iron maiden phantom opera,4,31871.120433648422,rock
rock classics,0,30623.48710031509,rock
band nthngfvce debuted first single levitate,0,31488.037100315094,rock
need recommendations,0,30697.470433648432,rock
dragonforce shared video finger freaking,0,31170.98710031509,rock
galaxie cbc show one solo groove amazing,1,30732.303766981764,rock
lookin something listen check playlist,0,30778.520433648428,rock
steely dan aja,0,31617.75376698176,rock
inception experimental era rock experiencing progressions miles davis told interviewer could put together greatest rock n roll band ever heard two years later made masterpiece thoughts rock fans,8,31368.18710031509,rock
funkadelic super stupid funk rock hard rock,1,32085.73710031509,rock
muse plug baby,0,31965.520433648428,rock
miss man,10,32761.353766981763,rock
created modern rock playlist reddit users,0,31760.00376698176,rock
pearl jam find breakthrough moments moments complacency gigaton independent music promotions,0,31764.920433648433,rock
thin dark line awesomeness,0,31661.837100315093,rock
jon bon jovi asks listeners help song,0,32243.337100315093,rock
best black sabbath tracks workout,7,31920.070433648427,rock
let know guys think band new album,0,32183.037100315094,rock
hi everyone project friisson first release ascend fan tool tessract alice chains karnivool may also enjoy link streaming download comments video guitar play hope enjoy,1,31972.75376698176,rock
shadow death take back,0,32061.95376698176,rock
elton john living room concert america surges million online shows defy coronavirus,0,32290.903766981763,rock
love rock n roll songwriter alan merrill dies coronavirus,2,33816.187100315095,rock
fern planet sorujagaruzu soldier girls,0,32330.20376698176,rock
check band maybe suck maybe good go big answer call live mystic ct,0,32337.520433648428,rock
long since forgotten hot house,0,32422.320433648427,rock
slide away oasis live knebworth think better recording best vocals ever,0,32424.153766981763,rock
dinosaur jr alone,2,32789.48710031509,rock
slow coming day watching fall apart,0,33068.303766981764,rock
cover guitar solo highway star deep purple,0,32852.170433648425,rock
brace impact wits end,0,33103.803766981764,rock
alan merill frontman band arrows originally recorded love rock n roll joan jett blackhearts famously covered song died coronavirus,0,33649.220433648436,rock
roll beethoven chuck berry ubiquitous,2,33207.203766981766,rock
valid reasons hating nickelback,6,33040.98710031509,rock
,0,33130.5871003151,rock
axl rose guns n roses vs vince neil motley crue wwe style match parody,1,33169.470433648436,rock
queens stone age one knows,6,34775.220433648436,rock
good rock history book,0,33372.8371003151,rock
king falcon shake shake shake rock,0,33629.90376698176,rock
lockdown rock,0,33505.50376698176,rock
black operator desolation blues raw blues n roll new single video shot isolation,0,33546.40376698176,rock
stephen malkmus defends ranking led zeppelin zoso,0,33595.3371003151,rock
joan jett blackhearts see light day separately,0,33604.037100315094,rock
jamwithjhs jhs pedals jam solo guitar rafa przystarz,0,33664.553766981764,rock
comezik good girl rock,0,33715.75376698176,rock
roger ebert ditched movie reviewing walked bar mailman named john prine performing ebert wrote prine instead giving first review,0,33725.48710031509,rock
sweet ballroom blitz,0,34473.62043364843,rock
war drugs april brooklyn complete show,0,34096.787100315094,rock
black rebel motorcycle club easy way ufc ultimate fighting championship rock music,0,34241.73710031509,rock
sick rock playlist definitely give listen,0,34267.537100315094,rock
drop kowashite destroy rock,0,35194.703766981766,rock
mad martin tr hot rod race rockabilly,0,34763.320433648434,rock
hey mercedes quality revenge last,1,34666.170433648425,rock
wake covid relief efforts please donate organization,0,34548.570433648434,rock
van halen instrumental,0,34627.15376698176,rock
lonely palaye royal,2,34863.420433648425,rock
never give love styles dangerfield song day,0,34672.0871003151,rock
shade uk trends rock trap,0,34742.887100315085,rock
mix pink floyd another brick wall hq,0,36042.420433648425,rock
donnie darko fox teeth check,0,35142.770433648424,rock
petty youth thing ffo acdc rhino bucket turbonegro,0,35177.60376698176,rock
slowride year snake,0,35279.520433648424,rock
count cromulent extrema garage psycedelic rock,1,35093.803766981764,rock
swedish alternative rock adama,0,35187.85376698176,rock
slayer dead skin mask,1,36306.48710031509,rock
type negative black,0,36527.87043364843,rock
chalk drifting new band,1,35704.98710031509,rock
music recommendations,7,35770.703766981766,rock
bare naked ladies,0,35979.770433648424,rock
questions eric combichrist sex slaves,0,35815.87043364843,rock
mix paul mcartney,0,36044.887100315085,rock
daron malakian scars broadway lives,2,36826.970433648436,rock
bringing rock back black country uk funny edge possibly catchiest riffs hooks short heath boyz lane head balti,0,36046.30376698176,rock
red animal war weak bones may break,0,35930.00376698176,rock
radiance effect beautiful,0,36039.137100315085,rock
j mascis stumble,0,36269.970433648436,rock
mix prince purple rain official video,0,36047.703766981766,rock
man drew rock weights,0,36182.85376698176,rock
sina radar love golden earring cover bluesmen channel blues rock super hits,1,36569.03710031509,rock
ocean breeze styles dangerfield,0,36444.98710031509,rock
moving parts stand still black sabbath,3,37373.02043364842,rock
vilivant never,0,36303.437100315095,rock
anarchy stone k rock punk,0,36672.203766981766,rock
jackie carol hospital,0,36744.937100315095,rock
austin roy singing bridge talent show,0,36408.937100315095,rock
tom waits jockey full bourbon,1,37571.28710031509,rock
come eileen bass cover,0,36630.953766981766,rock
hey guys slacker rock band salt lake city utah called oh ok released new single called wheel fortune would love get ears dig spread word,1,37866.637100315085,rock
mutation groove telemedicine,0,37713.570433648434,rock
mad season river deceit official video,1,38250.187100315095,rock
released first song would love feedback,1,38108.137100315085,rock
mads wolfe isolation trump rock,0,37227.50376698176,rock
forgetters deadly death,0,37264.953766981766,rock
high lights official audio,0,37650.28710031509,rock
zombie cranberries cover ethnic style,3,37725.30376698176,rock
evening wear mindless self indulgence,0,37391.98710031509,rock
cryptic culture fear love,0,37423.23710031509,rock
great band playing great album live,0,37669.453766981766,rock
vinum sabbatum songs convent full album,1,37530.00376698176,rock
dandy warhols live set chapel,0,38521.570433648434,rock
quarantine dan precision,0,37875.48710031509,rock
blood republic truth inside official lyric video,0,37897.15376698176,rock
beatles chemists,1,38831.02043364842,rock
shape blue team go,0,38086.3371003151,rock
hi guys always remember wash hands thoroughly,0,37947.670433648425,rock
band maid rinne hard rock,2,38605.30376698176,rock
deep purple throw bones,1,39049.070433648434,rock
mads wolfe kicks alt rock,0,38399.40376698176,rock
god god cycle,0,38195.170433648425,rock
help finding song,5,38789.77043364842,rock
r realrockheads sub discussing modern rock releases well older classic releases rock welcome,1,38851.03710031509,rock
soundgarden blow outside world,1,40007.137100315085,rock
sun smart phowned live quarantine sessions,0,38646.78710031509,rock
felix culpa apartment,0,38744.203766981766,rock
best instrumental rock,0,38844.37043364843,rock
miles slide,0,38892.03710031509,rock
jethro tull r rhf,0,39157.53710031509,rock
acd fragile,0,39439.920433648425,rock
metal fragile instrumental,0,39665.953766981766,rock
prince revolution darling nikki,3,40520.90376698176,rock
start virus massive,0,39633.453766981766,rock
composing post rock soundtrack videogame exist inspired osts games used play kid,0,39435.887100315085,rock
nick cave bad seeds get ready love,1,40518.27043364842,rock
junior varsity try define,0,39589.387100315085,rock
temple dog saviour,0,39988.87043364843,rock
iduna creeping alternative rock think even alt rock anymore,0,40160.387100315085,rock
coronavirus punkrock mix money never afraid produced theskybeats rell artwork,0,39941.10376698176,rock
datcha mandala stick rock,0,39983.220433648436,rock
coronavirus blues west skyward,0,40305.15376698176,rock
iron maiden hallowed thy name,4,41597.73710031509,rock
able baker fox kill,0,40339.953766981766,rock
audio learning center california,0,40224.35376698176,rock
mike campbell talks dirty knobs fleetwood mac life heartbreakers tom petty around would given music see came,0,40734.453766981766,rock
henry villaruel crowded,0,40690.470433648436,rock
pj harvey long snake moan,1,41689.070433648434,rock
apocalypse,0,40855.703766981766,rock
blackpool lights cursed,0,41014.25376698176,rock
nick cave bad seeds ft kylie minogue wild roses grow official video,2,42141.28710031509,rock
tool forty six,2,42106.48710031509,rock
halestorm familiar taste poison,0,41552.48710031509,rock
around,2,42000.703766981766,rock
marlon chaplin sleep,0,41784.820433648434,rock
non exotic bad scenery,1,41449.320433648434,rock
bad mother nature follyman official music video,0,41487.070433648434,rock
looking name song goes,9,41647.40376698176,rock
alice chains know something bout,0,42055.437100315095,rock
three days grace melody sorta,0,41932.48710031509,rock
tool stinkfist,2,42102.77043364842,rock
offspring kids alright,6,43214.25376698176,rock
guy legend,0,42041.48710031509,rock
youtube channels ad featuring song flock wolves,0,42472.77043364842,rock
katholicus lord,0,41853.85376698176,rock
casey hensley pray bluesmen channel blues rock super hits,0,42103.720433648436,rock
velocity demons,0,41886.470433648436,rock
five minutes freedom falling helpless,0,41888.78710031509,rock
rush discord,0,42195.77043364842,rock
sold man steve bago band,1,42012.220433648436,rock
bottlekids dark times wales uk,0,42518.12043364843,rock
jack ripper live glitchville quarantine,0,42080.10376698176,rock
fire ready funeral wedding vows,0,42469.65376698176,rock
acdc thunderstruck real life,0,42732.30376698176,rock
fake taxi driver beer fridge video made using free app material social media also discussion feelings experiences easy create share today using modern technology media,0,42621.220433648436,rock
rock band making,5,43475.80376698176,rock
favorite bands,12,42962.55376698176,rock
bush flowers grave,2,43481.05376698176,rock
share eternal playlist,1,43344.970433648436,rock
looking little quarantine help lol,9,43719.55376698176,rock
mr bungle recording first demo exclusive studio report part,1,43626.070433648434,rock
bipolar viper beliefs,1,43038.320433648434,rock
thin december see,1,43288.720433648436,rock
need advice writing chill alternative rock song,0,43327.25376698176,rock
quit smoking song,0,43162.570433648434,rock
coming prog rock band called get axe,0,43392.78710031509,rock
harder make music industry rock compared,0,43170.50376698176,rock
archers loaf writing new music years later,0,43733.85376698176,rock
criminally underrated riot outlaw,0,43448.65376698176,rock
teun segers blind faith want cake day share first single world,0,43460.90376698176,rock
stolen money one love official music video,0,43572.27043364842,rock
great new band,0,43410.720433648436,rock
acdc back black lie,0,43411.937100315095,rock
alice chains bleed freak,4,44874.23710031509,rock
smokin joe kubek bnois king mirror mirror chase bluesmen channel blues rock,0,43844.203766981766,rock
liltimbo mokum rockstar rock trap,0,43519.27043364842,rock
hangman stereo pharaoh,1,44028.05376698176,rock
small towns burn little slower lullaby sleeping babies,0,43903.75376698176,rock
k nd fix dopamine hey everyone listening likes pink floyd porcupine tree plini last years released first single band k nd realm prog rock would mean world guys would check,0,44541.10376698176,rock
def leppard joe elliott praises aerosmith new interview,0,45169.77043364842,rock
witchfynde moon magic,0,44443.30376698176,rock
hamtramck music festival recap,0,44560.3371003151,rock
favorite band come past years,16,44884.53710031509,rock
music video string acoustic rock riderr covid dreamqueens quisby tokes,0,44459.8371003151,rock
acdc thunderstruck everytime riff repeats band doubles,4,45656.55376698176,rock
bands surnames name,5,44512.00376698176,rock
indigo girls rock roll heaven gate,0,44773.73710031509,rock
escape frame die,0,44620.57043364843,rock
trying make quarantine new one enjoy black boxes quarantine alt rock,0,44624.25376698176,rock
heart joy worn weather,0,44770.37043364843,rock
wrote song long distance love coronavirus,0,44790.403766981755,rock
new interview joe elliott def leppard,0,45167.387100315085,rock
wj tobin blackout,0,44824.403766981755,rock
rock metal playlist,0,44962.97043364843,rock
see soft rock give good playlist thank,2,45209.78710031509,rock
beautiful mistake safe place,0,45346.62043364843,rock
blondie call,0,46460.35376698176,rock
deaf radio animals,0,45217.437100315095,rock
damned neat neat neat,3,46457.170433648425,rock
indiana jones theme blues rock cover shizzle nerds,0,45608.62043364843,rock
tregua zapada outro jam instrumental rock,0,45392.170433648425,rock
support subreddits bands see band subreddit comments follow add make subreddits great,0,45931.10376698176,rock
eighties matchbox b line disaster celebrate mother,0,45474.70376698176,rock
covid stop us recording new music npr tiny desk contest check new song persephone stay safe friends,0,45793.62043364843,rock
electric six gay bar,1,45804.60376698176,rock
grim reaper see hell traditional heavy metal,0,45702.137100315085,rock
curious norway offer terms coming rock bands check playlist,0,46733.82043364843,rock
good inxs songs guess thats rock,1,46353.32043364843,rock
american scene home,0,46043.62043364843,rock
green day come around,2,47874.97043364843,rock
australia newest upcoming rock artist reece mastin,1,46341.37043364843,rock
playlist vladdems spotify,0,46397.3371003151,rock
mads wolfe people alt rock,0,46583.420433648425,rock
link albums recognize folks check,1,46638.95376698176,rock
sorry x subject change,0,46675.53710031509,rock
tomorrow addiction name,0,46746.45376698176,rock
three days grace never,5,46831.75376698176,rock
interview rock artist deletto,0,47176.20376698176,rock
arsed record idk,1,47589.437100315095,rock
new depth music review linkin park crawling tribute chester bennington linkinpark crawling chester chesterbennington,0,47473.170433648425,rock
nearly unheard obscure yet awesome bands,8,47704.98710031509,rock
arsed record idk,0,47589.437100315095,rock
badguyswin lying grunge rock,0,47396.50376698176,rock
blackout wj tobin,0,47398.97043364843,rock
hey guys covid taking hold easy overlook significant events today second anniversary death cambodian rock legend singer kak channthy tragically killed road accident phnom penh touching account life friends family,1,48753.153766981755,rock
new irish artist,0,47726.35376698176,rock
moments grace patient,0,47513.53710031509,rock
tale sad man,0,47535.07043364843,rock
symphony destruction remix megadeth,0,47544.75376698176,rock
gypsybyrd mountain single,1,47626.27043364842,rock
billy earl mclelland tall girl short dress bluesmen channel blues rock super hits,0,48401.52043364842,rock
zz top tush bass cover lyrics,1,47742.637100315085,rock
cult sells sanctuary,3,49190.12043364843,rock
chevy kalpin objects mirror closer appear solo experimental rock bunch noiyyssee outta wyoming,0,47934.153766981755,rock
moving brooklyn symmetry,0,48207.82043364843,rock
good rockumentaries like joan jett bad reputation super duper alice cooper god bless ozzy osborne,4,48817.62043364843,rock
free pop punk x pop rock x blink type beat wings,0,48844.25376698176,rock
day age hourglass,0,49679.50376698176,rock
ever fall late night dance party,0,48969.87043364843,rock
flock wolves got hide love away,0,48972.8371003151,rock
dear sear year moment moment instrumental,0,49007.35376698176,rock
ramones blitzkrieg bop guitar vocal cover yoni saffra,0,49024.82043364843,rock
bain marie arcadian child superfonica,1,49064.48710031509,rock
life repeat waiting game,0,49091.137100315085,rock
sex pistols sub mission,6,50470.170433648425,rock
def leppard hysteria,0,50255.85376698176,rock
motive black broken,0,49254.72043364843,rock
sons apollo goodbye divinity progressive rock,1,49750.653766981755,rock
camaro canyon camaro canyon full play cc featured new film tea biscuits british mountain bike film,0,49800.77043364842,rock
need help finding band,3,49946.687100315095,rock
underated song,1,51061.437100315095,rock
finished new album hyperion check,1,50545.85376698176,rock
poco fans,2,50029.687100315095,rock
thoughts rock roll hall fame,2,50315.170433648425,rock
rock n roll wild thing know love waste time,0,50095.23710031509,rock
poorstacy empty room,0,50132.22043364843,rock
blue sky mile first many,0,50291.57043364843,rock
dropkick murphys perform stream free concert quarantine,1,51705.72043364843,rock
ocean feels like,0,50498.75376698176,rock
soccer mommy defines shades within color theory,0,50639.137100315085,rock
austin bullock waste case,0,50888.920433648425,rock
band cover del shannon runaway amidst covid pandemic,1,50958.420433648425,rock
linkin park numb,3,51890.8371003151,rock
dead red sea obscene calls,0,51134.85376698176,rock
ammonia z man,0,51978.420433648425,rock
trying find song,0,51545.55376698176,rock
til rick allen drummer def leppard lost arm car accident thought would never play friend noticed tapping foot listening music offered develop specially designed electronic foot pedal returned band,3,52860.05376698176,rock
songwriting,1,51441.403766981755,rock
debate,5,51830.687100315095,rock
mamma mia abba,3,52350.8371003151,rock
defeat low aurora avenue,0,51746.45376698176,rock
free pop punk x lil lotus x lil aaron type beat hydration,2,51879.170433648425,rock
strokes,3,53692.52043364842,rock
gentlemen japan ones,0,52563.77043364842,rock
living edge,0,52647.03710031509,rock
sometime world wishbone ash rock prog rock,0,52816.73710031509,rock
michael jackson eat heart,0,53304.687100315095,rock
death cab cutie fake frowns,0,53330.937100315095,rock
song made morning excited share think turned really nice,0,53302.87043364843,rock
hot hot heat bandages,0,53696.20376698176,rock
deftones drive cars cover alternative rock,0,54250.30376698176,rock
sign petition get ac dc play super bowl,8,54916.05376698176,rock
underrated drummer,7,54638.57043364843,rock
des rocks finding momentum loneliness,0,53772.153766981755,rock
culprit blame,0,54010.07043364843,rock
lonepeakmusic final lap hard rock,0,53860.28710031509,rock
daniel keane breaking beauty jangle pop,0,54039.02043364842,rock
trespassers thereafter,0,54046.73710031509,rock
roky erickson aliens interpreter rock music perfected,0,54450.78710031509,rock
queen another one bites dust,5,55808.85376698176,rock
aviate voluspa,0,54774.60376698176,rock
considered weird people school,8,54610.420433648425,rock
west skyward underestimating,0,55423.5871003151,rock
extraordinary life times genesis p orridge,0,55006.653766981755,rock
teeth weather related,0,54789.30376698176,rock
trying music laser valley call arms,0,54977.37043364843,rock
literally fall love dire straits,18,56449.8371003151,rock
ceo redemption,0,55185.50376698176,rock
kind regime tech,0,55326.03710031509,rock
hi guys made playlist reddit musicians get exposure spotify someone know interested spots playlist absolutely free follow simple steps comments hope hear music soon cheers good luck,2,56678.87043364843,rock
looking experimental producer,0,55632.37043364843,rock
spoon key stereo pharaoh,1,56239.30376698176,rock
found awesome new rock band wanted share everyone like punk green day think,0,56161.62043364843,rock
detroit groove gang midget boss pornstar garage rock,0,56910.3371003151,rock
beatles nowhere man acoustic cover,0,56166.97043364843,rock
circa survive glass arrows,0,56175.10376698176,rock
amy winehouse valerie played live cover version,0,56302.78710031509,rock
mighty bombs oh dear pop punk,0,56320.73710031509,rock
evento na augusta sp banda yr,0,56351.903766981755,rock
nosferatu close gothic rock,0,56714.23710031509,rock
otakusuite surfernova live tuscania,0,56381.10376698176,rock
red hot chili peppers dosed live,1,56556.403766981755,rock
yumi matsut ya reincarnation almighty,0,56558.47043364843,rock
blue yster cult moe play fear reaper live jammys,1,57851.07043364843,rock
rainbow catch rainbow live munich,3,57336.153766981755,rock
calarvey better alone,0,56900.12043364843,rock
grua think god listens machines post rock,0,56997.57043364843,rock
nazareth gimme mine,0,58066.30376698176,rock
rock comedy acoustic mr broccoli go away,0,58304.47043364843,rock
mads wolfe bloody sunday chill rock,1,57417.3371003151,rock
might die,13,58234.653766981755,rock
rate music classic rock leipzig germany shoot,0,57856.95376698176,rock
rage machine medley,0,57511.28710031509,rock
new vegas override,0,57537.53710031509,rock
interesting question,4,58077.05376698176,rock
mads wolfe snowman cocaine rock,0,58276.170433648425,rock
students rock cover middle high school battle bands,0,57706.03710031509,rock
lou reed walk wild side,3,59390.82043364843,rock
new single hiding magpies devil soul,0,58619.8371003151,rock
alex valdivia somewhere alaska,0,58779.45376698176,rock
districts know going anywhere album release,0,58921.07043364843,rock
fake taxi driver wanna goth garage rock,0,58930.437100315095,rock
aweful kanawful cry rock n roll,0,58710.55376698176,rock
crushed ready laugh never coming home,0,59619.57043364843,rock
sugestions,5,58900.23710031509,rock
birger dewil demons pills live,0,59128.903766981755,rock
similar bands fall boy,2,59209.70376698176,rock
southern cross care bluesmen channel blues rock super hits,0,59317.10376698176,rock
