title,comments,age,thread
trying find band name band hearing sxm octane remember vancouver island,1,59453.52043364842,rock
someone briefly educate ozzy osbourne,16,60604.98710031509,rock
daniel keane breaking beauty,0,59542.387100315085,rock
somebody tell band sounds like lilac grove alt rock,1,59577.28710031509,rock
mads wolfe mean machine alt rock,0,59808.437100315095,rock
androids pull apart,0,59596.28710031509,rock
genre rock best guess sludge metal,1,59929.72043364843,rock
never ever late november,0,59724.98710031509,rock
chris rea working remix beyond law bluesmen channel blues rock super hits,0,59975.82043364843,rock
one desire gone official video,1,59989.60376698176,rock
progressive rock song released band xihr,0,60686.187100315095,rock
g brain drugs,0,60750.78710031509,rock
last planet airflow,0,60631.77043364842,rock
new sid ww mask unboxing,0,60371.73710031509,rock
staring back note self feel dead,0,60521.87043364843,rock
investigating relationship music preference musical identity value orientation,0,60524.25376698176,rock
led zeppelin wins major copyright battle stairway heaven,6,62108.653766981755,rock
rail gonna bury,0,61169.05376698176,rock
rock playlist songs think deserve,3,61728.78710031509,rock
ozzy osbourne ft elton john ordinary man logic x remake prod insight,0,61427.72043364843,rock
said austin reed acoustic rock sessions ep,0,61492.55376698176,rock
victory numbers chemical,0,61919.72043364843,rock
homesafe full set hd live foundry,0,62151.82043364843,rock
minutes midnight skinny kid alternative rock official music video,0,62773.153766981755,rock
fly little bird flock wolves,0,62127.22043364843,rock
becoming human road dog rock latest single dropped,0,62415.437100315095,rock
ash eater bad trip official music video,0,62210.137100315085,rock
alexsandra ilieva help falling love elvis presley cover saxophone blues,0,62576.153766981755,rock
h vring jungle fever danish alt rock official music video,1,62596.153766981755,rock
awesome rock hybrid,0,62596.47043364843,rock
run last song song inspired rock progressive rock hope like,2,63724.03710031509,rock
interviewing eric billy mr big,2,63019.887100315085,rock
favorite rock songs suggestions,11,63373.187100315095,rock
joe mansman midnight revival band sellout,0,63066.27043364842,rock
song band eastgate titled haunted hope like accustomed well,0,63308.07043364843,rock
free music video anyone,0,64079.920433648425,rock
unifier traps,0,63384.78710031509,rock
naht real estate japan,0,63705.45376698176,rock
felony case strangers give,1,63545.98710031509,rock
mixing engineer need tracks,0,63998.32043364843,rock
need recommendations,1,63611.23710031509,rock
dust wind dd ruggito dell anima kansas cover,2,63981.87043364843,rock
built decay levin fans nirvana limp bizkit lil peep,0,63670.403766981755,rock
sweet child mine never heard,0,63982.687100315095,rock
jane addiction three days hq,0,64788.80376698176,rock
mist till summer fades away official music video,0,63852.10376698176,rock
nickelhouse coming official video,0,63855.60376698176,rock
rush wheels,0,64507.23710031509,rock
oxbow narcotic story full album,0,63876.437100315095,rock
suugaan essena hu studio version,0,63952.95376698176,rock
long vinyls new band,0,63973.920433648425,rock
helen earth band silence,0,64008.12043364843,rock
sleater kinney dig,0,64808.25376698176,rock
best friend got four songs onto spotify,3,65258.637100315085,rock
released new music power trio canada,0,64813.05376698176,rock
flood red harmony,0,64839.653766981755,rock
elvis presely lawdy miss clawdy rock n roll,1,65699.43710031509,rock
cover box tops song letter,0,64819.45376698176,rock
strangers guns tired sleep ok drive irish grunge,0,64904.72043364843,rock
rock music making comeback,8,64910.82043364843,rock
merch start,1,64928.920433648425,rock
crazy trip nyc luke rathborne ordinary woes,1,65203.187100315095,rock
ultragotha stereo pharaoh,1,65475.687100315095,rock
scattered lights live th october alemageddon,0,65211.0871003151,rock
battle manchester lot prefer ian browns voice liam gallaghers,1,65242.85376698176,rock
black top town bluesmen channel blues rock super hits,0,65244.20376698176,rock
harold last chance hold breath multi instrumentalist punk,0,66142.95376698178,rock
song wrote today flock wolves new style acoustic blues,0,65361.12043364843,rock
shangrila happy alt rock post punk,0,65857.2871003151,rock
atlas losing grip shallow,0,65434.05376698176,rock
freddie mercury adam lambert side side comparison champions queen,0,65541.62043364842,rock
king rock specially designed playlist elvis presley royal remixes,0,65551.30376698176,rock
mads wolfe gone folk rock,0,65718.10376698176,rock
look hands snacks,0,66173.90376698176,rock
top rock roll samantha fish cigar box viewed samantha fi,0,66359.37043364842,rock
nickelback coin ferryman,4,65400.25376698176,rock
english version famous russian song viktor tsoi cuckoo performed even blurry videos igor sakharov,0,66540.7871003151,rock
game changers rock colloberative spotify playlist,1,66448.48710031509,rock
trapt hollowman,17,66889.0371003151,rock
new trolls movie interesting ideas rock music,10,67441.97043364843,rock
survey correlating music exercise high school student,1,66539.98710031509,rock
flock wolves suns gonna shine,0,66474.40376698176,rock
top rock roll samantha fish run viewed samantha f,0,66859.52043364843,rock
thungur quiet,0,66748.73710031509,rock
,0,66753.93710031509,rock
ever wonder ad libs saying amazing aerosmith,0,67112.55376698176,rock
cure disintegration,0,67999.93710031509,rock
band young bird released new single move let us know think,0,66935.70376698178,rock
one nation underawed,0,67561.75376698175,rock
silverstein beautiful place drown,0,67820.12043364842,rock
normal conversation rock roll,4,67396.22043364843,rock
dire straits telegraph road final bluesmen channel blues rock super hits,0,68245.7871003151,rock
newbie start rock,3,67772.60376698176,rock
scorpion child sings kill live good music club,2,67727.37043364842,rock
hey guys please vote linkin park paramore link mean lot us,0,67511.50376698175,rock
everyday sunday story,0,67588.8871003151,rock
nickelhouse one official video,0,67761.5371003151,rock
darkhorse collective drying official music video,0,67792.55376698176,rock
gr zon baby blue blues rock,0,67863.45376698178,rock
muscle vest noise rock band london,1,68169.48710031509,rock
posh chocolates gaudy indie rock pop,0,68063.3871003151,rock
one first best turkish rockers,0,68069.85376698176,rock
laura cox going freddie king cover bonus bluesmen channel blues rock super hits,0,68729.50376698175,rock
dust post indie,0,68146.73710031509,rock
sings black sabbath songs dio ozzy tell,2,68195.02043364843,rock
mads wolfe holding folk rock,0,68269.73710031509,rock
crimson clover denmark winter guitar cover,0,68312.17043364843,rock
jars auction,0,68336.5371003151,rock
braille spanish dagger,0,68337.18710031509,rock
underrated black musicians everyone know,7,69194.57043364843,rock
crimson clover denmark winter guitar cover,0,68790.25376698175,rock
run hounds lost black,0,69153.87043364842,rock
silverstein bad habits official music video,0,69127.43710031509,rock
paper sons fine line,0,69781.73710031509,rock
please checkout debut single,1,69397.20376698178,rock
moondogs billy,0,69052.35376698176,rock
fast car florence cry,0,69427.30376698176,rock
astral king first singles,0,69557.92043364843,rock
badguyswin needle beach,0,69575.8371003151,rock
fast car florence cry rock,0,69428.30376698176,rock
scarlett classic three reasons scared life,0,69729.8871003151,rock
dead sara test patience,1,70305.15376698176,rock
rockbottem,0,69984.98710031509,rock
anyone check bands first single,2,70617.5371003151,rock
room sheitan fire twin rock rap metal electro,0,69814.77043364843,rock
bl black nephew,3,71033.12043364842,rock
rock sheet music,6,70734.95376698178,rock
anyone wanna check first track,5,71243.3371003151,rock
pipe bomb feral vices,2,70603.43710031509,rock
dambuilders delaware,0,70480.52043364843,rock
dave kuchler really lasts power pop alt rock,2,71060.6371003151,rock
flock wolves ballad big nothing,0,70605.98710031509,rock
original mine would great could check,1,71033.52043364843,rock
charivari descent shoegaze post punk noise rock,0,70700.05376698176,rock
john butler trio want,0,71294.17043364843,rock
geordie brian johnson got know bluesmen channel blues rock super hits,0,71110.85376698176,rock
best subs alt bands like qotsa superheaven etid stp,4,71516.23710031509,rock
mads wolfe sea folk rock,0,71207.77043364843,rock
considered acdc first album officially,1,71498.20376698178,rock
best rock albums classicrockhistory com,2,71873.73710031509,rock
stars go cold hey valentine,0,71191.15376698176,rock
cathartic anomic schadenfreude playlist slvrngld spotify,0,71604.68710031509,rock
dani gonzalez intuition,0,71260.02043364843,rock
cuban heels rosie bluesmen channel blues rock super hits,0,71407.32043364843,rock
new community love live music wanted share connect original artists got new single drop years lineup change filmed making anyways check connect us dig single drops sunday haha,0,72056.85376698176,rock
track khari killers midnight show freestyle,0,71537.18710031509,rock
epic solo still epic,0,71946.00376698175,rock
mads wolfe liquid gold alt rock,0,71589.77043364843,rock
small independent originals rock band london time please listen hope enjoy,4,72754.02043364843,rock
becoming sons open arms new single sacrosanct records,0,71765.93710031509,rock
twin atlantic light laughter,0,72013.68710031509,rock
teenage fanclub know,1,72662.6371003151,rock
puppets mr cricket,0,71988.07043364843,rock
help transcribing lyrics,0,72073.2871003151,rock
cheap smokes thirty years,0,72109.35376698176,rock
original flock wolves rock song tell acoustic rock,0,72119.37043364842,rock
diarchy kamal hossen stoner rock india,0,72411.35376698176,rock
looking good j rock band violin one main instruments,1,72582.3871003151,rock
independent vote link godsmack best album,0,72260.12043364842,rock
ozzy osbourne shot dark,0,73708.7871003151,rock
hate heros alive,0,72285.27043364843,rock
suggest playlist sorry moderator people check,0,72466.37043364842,rock
drum cover led zeppelin moby dick,0,73391.87043364842,rock
two bands ever come together make collaborative album,9,73515.15376698176,rock
would guys consider kamelot black halo today,0,73101.42043364843,rock
cupcakes hard compared anyone else rocks hard,0,73149.6371003151,rock
based poem bukowski,0,73237.2871003151,rock
bipolar viper night passes hard rock,0,73263.32043364843,rock
brother band released first ep think pretty great vocals main guitar band barrie,8,74677.18710031509,rock
little self promotion three piece nj garage rock band,0,73539.85376698176,rock
hey guys song made acoustic,0,73315.1371003151,rock
first ep needs listeners huge effort need help learning everyone welcome,7,73845.47043364843,rock
watch burning windows tramp official music video youtube,0,73823.62043364842,rock
