title,comments,age,thread
lil peep mother sues mgmt causing death possibly millions,0,10255.387286603449,rap
san francisco california,0,10263.553953270117,rap
new coming artist story tell story maybe una jokes aside talented kid check music craziest flow,0,10498.620619936784,rap
beat smooth,0,10299.253953270118,rap
bad nostalgia sad summer,0,10310.470619936783,rap
music video made looking feedback thank advance,10,10543.053953270117,rap
juice wrld guitar type beat think,0,10555.470619936783,rap
ssjmelo back square one opinions,0,10346.68728660345,rap
infinite never fall back,0,10365.487286603453,rap
gungaginga lil clipz free listening soundcloud,0,10376.237286603453,rap
certainly x lil durk real rich,0,10400.03728660345,rap
movie party one kyle based true story,1,10435.503953270118,rap
certainly river flow part,0,10444.170619936784,rap
anyone want free beats,4,10802.837286603452,rap
discussion fat joe still hit maker,3,10480.803953270117,rap
instrumental rap instru hip hop boom bap type beat feat djeebeats,0,10506.103953270118,rap
sub opinion british rap specifically trap drill,4,10507.970619936783,rap
iraqi rapper mcanhar iraq protests,1,10519.253953270118,rap
check sound cloud pimp juice,1,10546.503953270118,rap
rap songs dont feel like going tonight opinion,0,10555.820619936783,rap
language think rap sounds better,64,11852.953953270116,rap
chxpo x tay k x keyboard kid based freestyle,0,10569.43728660345,rap
new industry listen collectives qsrjam new song nice things let us know think,0,10647.387286603449,rap
thinking giving rap make beats,4,10693.78728660345,rap
,2,11314.653953270117,rap
two artists like see collab,6,10742.353953270118,rap
keep trash rap names,5,10857.03728660345,rap
free nle choppa x dababy type beat shots da baby instrumental stunna vegas type beat,0,10911.820619936783,rap
check,0,10918.753953270118,rap
bump gungaginga,0,10936.737286603453,rap
hip hop rap artist got school including college university,9,11661.03728660345,rap
discovery trap beat,0,11091.137286603449,rap
dovedo bling freestyle,0,11211.170619936785,rap
buddy released first music video along debut project done house low budget let know think,7,11813.487286603453,rap
absolute doubt clever never satisfied,0,11469.820619936785,rap
major writer block months,1,11622.637286603449,rap
beat chill,0,11519.820619936785,rap
tekashi snitched would,5,11520.003953270118,rap
beat made wierd file issues sorry name fed,0,11300.237286603453,rap
horror rap new album,0,11312.353953270118,rap
organic michael anthony feat jo sef rap songs rap music videos,0,11337.18728660345,rap
ive improving since last post still got ways go,0,11341.737286603453,rap
released first melody loop pack lmk think,1,11607.970619936785,rap
yung hade freestyles hour,2,11743.53728660345,rap
old school boom bap type beat thug tears prod clio,0,11406.803953270117,rap
yall grade live written harshest realistic critic,2,11658.820619936785,rap
looking video,0,11455.803953270117,rap
generations rap,0,11472.53728660345,rap
dominant rap genre lyrical spiritual hardcore gangster rap melodic emo rap storytime telling songs know missed genres dominant genre best musician genre opinion,21,12616.18728660345,rap
gungaginga lil clipz free listening soundcloud,0,11754.070619936785,rap
frog andtoad hunger prod false soap,0,11533.853953270118,rap
reality,7,12065.003953270118,rap
smokemajor chicks getting freaky,0,11556.920619936785,rap
new beat leave feedback,0,11566.053953270117,rap
joker happy free beat,0,11576.220619936785,rap
think post malone collaborating ozzy osbourne take want overall would want see rappers collaborating rock metal artists,4,11807.853953270118,rap
post malone popular,13,11623.93728660345,rap
itsoktocry vanessa f feat bby goyard shinigami,1,11867.320619936785,rap
lil uzi vert dropped eternal atake,0,11643.220619936785,rap
persian rap exists,5,11660.853953270118,rap
trying get music want listeners happy enjoying would awesome took time check,3,11663.753953270118,rap
think night lovell type beat bath salts clash thoughts evil mind depression sticking like porcupine smoke fat tie hit dabbie feel divine,1,11717.320619936785,rap
notorious b g suicidal thoughts izzamuzzic remix,0,11725.03728660345,rap
free tay keith x blocboy jb type beat payday freestyle type beat rap trap instrumental,0,11763.870619936784,rap
snippet experimental mixtape working rn one influenced folk rock would appreciate would check,0,11766.020619936784,rap
lyrics sound,4,11780.070619936785,rap
mjstacks ft j boogz great prod pyrobeats audio,0,11791.353953270118,rap
afterpvrty minutes hip hop music,0,11799.853953270118,rap
free non profit frequency boost binural type beat,0,11804.603953270118,rap
good rap bar,5,11833.420619936785,rap
professional mixing mastering,2,12071.053953270117,rap
name freestyle beat sweet dreamz lillefan li lle fan,0,11852.43728660345,rap
ssjmelo back square one opinions,2,11900.68728660345,rap
meek better kanye,4,11910.753953270118,rap
free recollection savage x metro boomin type beat,0,11921.887286603449,rap
lyrics sound,1,11940.803953270117,rap
dark blue,0,11975.18728660345,rap
uploaded new track yesterday getting traffic let know guys think pressure code man,0,11982.203953270116,rap
eth beats motivation hard,1,12084.620619936784,rap
use gospel kanye west remake,0,12118.103953270118,rap
good songs,17,12932.487286603453,rap
pg county rapper lil grim talks beating death twice upcoming album,0,12129.903953270117,rap
listen new song new young rapper goes name young f g,4,12137.153953270117,rap
eth beats motivation hard banger beat free beat,0,12383.587286603452,rap
one tha beats made,3,12751.503953270118,rap
make ganius type quotes,1,12170.53728660345,rap
san francisco california,0,12185.170619936785,rap
weekly r rap coming artists thread post favorite underground artists even,2,12219.853953270118,rap
think done music might last song ever put,3,12242.753953270118,rap
newbie rapper,4,12525.770619936784,rap
started getting rap someone recommend angry songs similar nf search eminem till collapse,13,12811.370619936784,rap
hi guys spent every day life since july th broadening musical horizons locked room late night work mastering craft absolute tea receiving much hate backlash present real ones tape,11,13744.820619936785,rap
one tha first bests ive made,0,12741.43728660345,rap
hades hazard feat zotiyac prod hushinsilence hard af visualizer,1,12399.53728660345,rap
song cant tell good soundcloud rap shit,0,12402.737286603453,rap
gungaginga,0,12417.953953270116,rap
rwm milli understand,0,12424.653953270117,rap
gonna make someone famous subreddit,2,12688.453953270116,rap
mumbling rap kind like singing song,30,12098.270619936784,rap
halp,0,12554.420619936785,rap
prefer lyrical spiritual rap mumble melodic,11,12785.270619936784,rap
new track city believe dedication j dilla,0,12618.670619936785,rap
brandon kai fuck day,0,12659.887286603449,rap
r e relay,0,12665.837286603452,rap
lil xelly big knots hard knocks compilation new futuristic trap rapper dmv,1,12896.68728660345,rap
finished new track pressure let know anyone interested taking second verse,3,13152.020619936784,rap
sun,2,12926.820619936785,rap
boss talk vol trilly mixtape,0,12942.220619936785,rap
first beat making video youtube gentle haha,4,12976.070619936785,rap
ever heard beef flomix,0,12762.270619936784,rap
cousin n second guy lol,0,12793.53728660345,rap
cashbently idk woodpecker,0,13207.920619936785,rap
sebii chikorita prod slayer,1,13313.387286603449,rap
dr anthony,0,12979.43728660345,rap
collaborative playlist,0,12990.403953270117,rap
album,2,12994.753953270118,rap
imam e,0,12999.78728660345,rap
hope dude gets discovered,1,13079.020619936784,rap
tell genre rap,0,13346.53728660345,rap
free rich kid x lil uzi vert type beat grateful new wave type beat,0,13127.120619936784,rap
dice hades mr rogers prod franky clipmanckooo kson blocka diss,0,13137.070619936785,rap
free nle choppa x dababy type beat shots da baby instrumental stunna vegas type beat,0,13142.153953270117,rap
looking young thug,0,13143.887286603449,rap
genius challenge verified,0,13173.387286603449,rap
san francisco california rap,0,14036.220619936785,rap
looking collaborate,0,13219.803953270117,rap
listen awsome song lit guys,1,13235.803953270117,rap
sterlo essence,0,13263.28728660345,rap
lil tjay x polo g type beat cages prod xander,0,13271.453953270116,rap
free valee x splurge type beat slide k upreme x chasethemoney type beat,0,13497.53728660345,rap
lemme know think,0,13276.703953270116,rap
ssjmelo back square one opinions,0,13310.887286603449,rap
gungaginga lil clipz free listening soundcloud,0,13330.270619936784,rap
free moneybagg yo type beat loaded free type beat rap trap instrumental,0,13353.603953270118,rap
baby goth x dna name baby goth episode,0,13375.253953270118,rap
travis scott sidepiece prod pulver,0,13406.703953270116,rap
new music feedback would much appreciated,0,13411.087286603452,rap
gretzky rap,0,13415.487286603453,rap
check latest song feedback much appreciated thanks,0,13424.403953270117,rap
improve diversity musically yall wanna hear music n give feedback please,0,13654.487286603453,rap
yuck foo lil pump type beat free,0,13435.553953270117,rap
k ix,2,14187.520619936784,rap
free cold emotion type beat blow zion dean heize type beat,0,13966.587286603452,rap
broken emotional rap beat instrumental sad rap beat instrumental imperiumbeatz,0,13459.353953270118,rap
eminem moonlight ft kalash damso official video,1,13469.720619936785,rap
travis scott exposed alleged side chick reason travis kylie broke,0,13471.403953270117,rap
san francisco california bity bank freestyle,0,13503.920619936785,rap
travis scott ft gunna x young thug type beat chain reaction,0,13504.470619936785,rap
see tha carter v underrated,0,13518.087286603452,rap
free moneybagg yo type beat loaded free type beat rap trap instrumental,0,13537.020619936784,rap
loyal machette nina music video,12,13550.53728660345,rap
free dababy x offset type trap beat bank,0,13580.820619936785,rap
first song need feedback brutal,3,13588.487286603453,rap
need help learning produce music idea start,1,13821.453953270116,rap
gungaginga lil clipz free listening soundcloud,0,13697.853953270118,rap
lil tappers n word,0,13715.053953270117,rap
illmatic xx th anniversary special edition,4,14951.93728660345,rap
price money future commas freestyle,1,13727.237286603453,rap
rap theory fans ou wanna group discuss chat maybe start discord server,0,14395.253953270118,rap
new spotify playlist floating,0,13848.803953270117,rap
going forget classic,1,13873.637286603449,rap
free moneybagg yo type beat loaded free type beat rap trap instrumental,0,13879.737286603453,rap
cannot find name rap song,2,14139.887286603449,rap
exile beezy like best rnb music top rnb music videos,0,14044.03728660345,rap
made beat j cole yall think,1,14576.18728660345,rap
j rich maxim official music video,0,14157.753953270118,rap
hardest album trapped tokyo joey trap album review reaction goes hard,0,14172.003953270118,rap
okay sure may amature makings something bigger tell think,1,14186.520619936784,rap
hard rap songs playlist,6,14197.070619936785,rap
year old rapper mn,1,14208.553953270117,rap
spitty loser,1,14596.570619936785,rap
let collab,1,14248.087286603452,rap
daddy stress featuring r rugged man,0,14525.103953270118,rap
year old florida rapper new song goes hard,3,14310.520619936784,rap
go listen album heat,0,14762.920619936785,rap
beginning rapper getting started really appreciate guys checking music hitting like subscribe enjoy plus advice could give far improving channel youtube anecdote use link,8,14790.553953270117,rap
distrokid discount sign link distrokid gets music spotify apple music deezer ect,0,14605.387286603449,rap
find rap songs like,1,14751.570619936785,rap
opinions ty dolla sign,4,14457.087286603452,rap
rich kid x lil tecca type beat fendi,0,15100.503953270118,rap
know longlivesteelo,1,14522.620619936784,rap
free moneybagg yo type beat loaded free type beat rap trap instrumental,0,14561.420619936785,rap
peta kills dogs boy dropped produced fully us spare minutes listen let know think,0,14564.353953270118,rap
track kinda blowing go check,1,14580.853953270118,rap
guys think nle choppa,17,15773.853953270118,rap
gentle morning quixote sad boi vibes looking tips community,1,14614.753953270118,rap
new chill lofi beat,0,14624.803953270117,rap
joyner lucas blew remixes,0,14631.370619936784,rap
free lil loaded x nle choppa cigarettes type beat,0,14645.003953270118,rap
space bounce adventure,0,14655.153953270117,rap
choz n feat stoner jordan flawless wigsplit,0,14673.487286603453,rap
anyone lyrics shaq diss damian lillard,1,14917.470619936785,rap
ssjmelo back square one opinions,0,14708.720619936785,rap
gunna x calboy type beat python prod xander,0,14713.103953270118,rap
think lil peep rip,3,14954.237286603453,rap
free moneybagg yo type beat loaded free type beat rap trap instrumental,0,14739.653953270117,rap
remixes,0,14742.370619936784,rap
conkrete rap rap,0,14743.270619936784,rap
better da baby lil baby,5,14775.28728660345,rap
check last indie hip hop around globe esmr livewire,0,14789.403953270117,rap
san francisco california rap,0,15015.270619936784,rap
dj premier bars booth episodes,0,15021.120619936784,rap
changed music,0,14873.653953270117,rap
free moneybagg yo type beat loaded free type beat rap trap instrumental,0,15148.820619936785,rap
free chance rapper x bryson tiller type beat night talks,2,15167.737286603453,rap
teddi mor full official audio,0,14942.520619936784,rap
free jid x dreamville type beat meaning,0,15060.303953270117,rap
make free profit beats sole purpose help skilled rappers starting make money channel views trust promo attempt check,44,16438.253953270116,rap
first show ever performing la tips sell tickets could support homie side hustle tbh first show idk even get perform sell tickets rapping since,2,15735.720619936785,rap
free juice wrld x iann dior type beat call crazy prod paradox,0,15232.837286603452,rap
gungaginga,1,15298.637286603449,rap
sansar salvo duygusal olmaya gerek yok ft ehin ah canl performans,0,15318.470619936785,rap
free nle choppa x dababy type beat shots da baby instrumental stunna vegas type beat,0,15340.353953270118,rap
camera,0,15789.970619936785,rap
check n lmk whatchu think,0,15444.953953270116,rap
beat hard,0,15451.737286603453,rap
brand new drop hux jake clarke juice wrld x nba youngboy bandit remix,0,15498.28728660345,rap
one solid still,0,15499.68728660345,rap
please review song,0,15512.93728660345,rap
easily dopest playlist,0,15891.370619936784,rap
need put ou,0,15568.820619936785,rap
murk layer isis remix,0,15612.903953270117,rap
epic rap spotify playlist enjoy,0,15620.320619936785,rap
joyner lucas joke,1,15471.203953270116,rap
self promotion reddit groups,0,15702.53728660345,rap
vince staples norf norf,1,15705.28728660345,rap
dice hades willy wonka,0,15710.737286603453,rap
young rapper looking help,0,15759.43728660345,rap
highest room travis scott dropped review everyone else think,14,16957.503953270116,rap
san francisco california rap,0,15886.987286603453,rap
prod,0,15904.820619936785,rap
meme sample kahoot x yung gravy type beat kahoot meme type beat,2,15916.920619936785,rap
hey rappers drive full free beats weekly thread day verse challenge,0,16371.003953270118,rap
try rap,0,15934.903953270117,rap
lost respect nas allowing lil nas x use name,3,15942.870619936784,rap
rap song,0,15954.93728660345,rap
rockstar linkin park type beat rap rock type beat prod imperiumbeatz,0,16002.970619936785,rap
sad beat sad boys,0,16010.270619936784,rap
hat wer noch die donetasy apfel ep,0,16053.270619936784,rap
san francisco california rap,0,16060.353953270118,rap
hat wer noch die meskalin maskulin tracks,0,16065.28728660345,rap
ssjmelo back square one opinions criticism,0,16093.237286603453,rap
instagram hashtag strategy double growth views,0,16106.137286603449,rap
free pierre bourne x playboi carti type beat droptop prod pearly looking feedback style,0,16106.753953270118,rap
hat wer noch die donetasy apfel ep,0,16117.103953270118,rap
free nle choppa x dababy type beat shots da baby instrumental stunna vegas type beat,0,16122.403953270117,rap
new artist dropping month,0,16126.18728660345,rap
jackson remix never say goodbye sample beat,0,16127.270619936784,rap
blessed freestyle,0,16141.753953270118,rap
ronny j vibes free non profit,0,16142.703953270116,rap
new guitar beat free use,0,16150.78728660345,rap
e l running away,0,16173.670619936785,rap
first ever song trash feedback really appreciated,0,16401.920619936784,rap
rap song,1,15954.837286603452,rap
doja cat live hawaii,0,16200.253953270118,rap
old hip hop suggestions,1,16200.370619936784,rap
need professional mix mastering cheap,0,16202.353953270118,rap
ty lit insomnia,0,16232.670619936785,rap
juice wrld ft nba youngboy bandit must watch reaction,0,16233.68728660345,rap
mark words,0,16241.153953270117,rap
opinions new music video,0,16244.653953270117,rap
first therapy session bunch stuff song one would probably get appreciate tell think give constructive criticism,0,16244.93728660345,rap
gungaginga lil clipz free listening soundcloud,0,16254.120619936784,rap
knoxville,0,16274.120619936784,rap
coming talent,1,16320.770619936784,rap
eminem paranoid ft post malone official video,0,16337.487286603453,rap
check,0,16339.053953270117,rap
dark fame future x young thug type beat hard trap beat prod imperiumbeatz,0,16356.253953270118,rap
free juice wrld type beat street prod kalex,0,16397.153953270117,rap
best lil baby x gunna beat,1,16402.13728660345,rap
wish iann dior x lil mosey type beat prod unknwn,0,16417.83728660345,rap
good underrated rap songs,2,16662.420619936784,rap
mista ghost,0,16441.503953270116,rap
thoughts highest room,1,16475.703953270116,rap
think,0,16514.903953270117,rap
incoming toronto upcoming talent get use name j,3,16517.470619936783,rap
mustard ballin ft roddy ricch,4,17712.103953270118,rap
mac miller tribute j leery dunno available youtube,0,16979.003953270116,rap
cheap professionally done mix mastering,0,16551.720619936783,rap
money man,2,16570.55395327012,rap
made something,1,16599.55395327012,rap
blackbear x juice wrld x khalid type beat vegas,0,16617.403953270117,rap
free nle choppa x splurge type beat moves rap instrumental,0,16722.470619936783,rap
eth beats imperfections banger beat,1,16780.470619936783,rap
wiley givenchy bag feat future nafe smallz chip,0,16794.537286603452,rap
would rate rappers order,8,17030.903953270117,rap
rockstar linkin park type beat rap rock type beat prod imperiumbeatz,0,16824.170619936784,rap
spongebob whole operation water,0,16854.703953270116,rap
new song freestyled feedback appreciated,0,16855.953953270116,rap
san francisco california rap,0,16865.83728660345,rap
dillon fuego,0,16876.470619936783,rap
pay play songs,13,17479.453953270116,rap
soundcloud rappers,6,16915.653953270117,rap
sam blue flow,0,16946.703953270116,rap
minnesota twins rap postseason hype made,0,17234.853953270118,rap
race,9,17047.203953270116,rap
brandon kai fuck day official music video,2,17444.653953270117,rap
looking people interested starting rap group,3,17099.970619936783,rap
yr old kid spits bars,1,17510.33728660345,rap
happened eminem,9,16795.80395327012,rap
gungaginga lil clipz,0,17174.73728660345,rap
lit wuulvz outta way official music video,3,17967.153953270117,rap
beat hard,0,17430.170619936784,rap
like kid cudi playboi carti kid cudi indian version cjchi reaction,0,17240.18728660345,rap
prophet synergy,0,17243.68728660345,rap
san francisco california rap,0,17488.253953270116,rap
better last attempt,0,17400.170619936784,rap
jake lewis happy graduation,0,17404.253953270116,rap
attention soundcloud rappers,0,17407.23728660345,rap
chxpo x lil gnar gnarly gang,0,17436.703953270116,rap
travis scott career made kylie jenner,2,17447.003953270116,rap
rockstar linkin park type beat rap rock type beat prod imperiumbeatz,0,17449.48728660345,rap
rise new currency rupee dollar,0,17449.820619936785,rap
music video would love feedback,0,17676.38728660345,rap
first song yes know mixing bad,2,17451.620619936784,rap
check new pantheon hip hop group made solely members r makinghiphop subreddit,0,17465.453953270116,rap
art,2,17485.787286603452,rap
kid makes trash freestyle,0,17493.903953270117,rap
rap,0,17499.703953270116,rap
shoutout lilseanmusic,0,17511.570619936785,rap
first sober rapper ever heard,0,17964.003953270116,rap
da baby vibez crazy reaction,1,17519.970619936783,rap
first song ever written,2,17536.370619936784,rap
rich rocka run official video,0,17564.720619936783,rap
hey r rap made chill rnb hip hop playlist called soul study rap almost k followers looking submissions october edition deadline,1,17805.570619936785,rap
hz gunna x nocap kylie type beat fire,0,17590.503953270116,rap
calboy x lil tjay type beat diamonds prod xander,0,17592.253953270116,rap
gungaginga,0,17594.453953270116,rap
free nle choppa x splurge type beat fax k upreme x stunna vegas type beat,4,17627.83728660345,rap
ssjmelo back square one opinions criticism,0,17638.903953270117,rap
cringe nerd hit prod evince beats official music video,0,17645.453953270116,rap
compton morning ice cube type beat dr dre type beat west coast type beat prod imperiumbeatz,0,17887.30395327012,rap
looking collab conscious motivational rap pm interested,1,18031.13728660345,rap
official music video toso heavy therealtoso,0,17690.55395327012,rap
recorded tell think,0,17697.537286603452,rap
watch double bars diib video inspired eminem rap god,0,17702.43728660345,rap
anyone else iffy female voices rapping,2,17710.33728660345,rap
like got conscience,0,17715.953953270116,rap
please check newest song got time guys like speedy flows banger beats definitely dig,0,17740.820619936785,rap
free nle choppa x splurge type beat moves k upreme x stunna vegas type beat,0,17751.770619936786,rap
song blow,6,18204.220619936783,rap
cam chris like dice,0,17782.753953270116,rap
top rappers time,15,17784.853953270118,rap
gretzky rap,0,17817.520619936786,rap
looking features,9,18402.170619936784,rap
eminem greatest,5,17826.203953270116,rap
sodomy slim runaway dildo,0,17842.98728660345,rap
recorded silence years sitting finished songs released first three lemme know think,17,19090.420619936784,rap
san francisco california cheddar limited edition rap,0,17942.270619936786,rap
rap collab ft,14,18815.83728660345,rap
full beattape hemp vol surge um novo estilo,0,17961.38728660345,rap
rap lose challenge hardest version,1,17980.703953270116,rap
message people said gonna make,3,17804.370619936784,rap
top goat list,16,18489.08728660345,rap
lil tecca x nav type beat one step,0,18061.70395327012,rap
excited drop one looks like shot egypt,2,18427.50395327012,rap
dice hades apollo prod chillingcat,0,18078.50395327012,rap
bandz ft uncle bandana dyfferent lyfe style,0,18164.58728660345,rap
lyricist looking opinions current project,2,18542.820619936785,rap
heard indian rap yes song trying spread scene,1,18197.30395327012,rap
free nle choppa x splurge type beat moves k upreme x stunna vegas type beat,0,18197.63728660345,rap
anyone else lyrical rap unique funky flows kinda like yung gravy favourite artist,6,18233.53728660345,rap
piz rip,0,18240.603953270118,rap
old english rap,0,18250.220619936783,rap
san francisco california cheddar limited edition,0,18327.103953270118,rap
g day first track melbourne australia tryna get shit somewhere let know think,21,19488.75395327012,rap
clown ix ine gummo snitch remix cjchi recaction,0,18479.853953270118,rap
lets check new type beat,1,18500.63728660345,rap
playlist challenge possible prize,0,18513.020619936786,rap
need help,0,18530.38728660345,rap
whos fav rapper mine comethazine,18,19071.28728660345,rap
car like,1,18638.920619936784,rap
ghost writing,3,18644.28728660345,rap
san francisco california cheddar limited edition rap,0,18650.13728660345,rap
looking meme rappers,5,18685.48728660345,rap
old school boom bap type beat thug tears prod clio,0,19325.770619936786,rap
attempt rapping criticism appreciated,11,19284.95395327012,rap
beat smooth,0,18942.45395327012,rap
let know think make joke songs btw,0,18726.88728660345,rap
lethal prod penacho ft nasper allen f,0,18747.73728660345,rap
free mac miller x j cole type beat life,0,18806.33728660345,rap
even dvn bustdown prod hoodwil,0,18806.68728660345,rap
tyga possibly stealing kylie jenner travis scott,1,18841.25395327012,rap
san francisco california freestyle rap,2,18842.75395327012,rap
cold world cold world ik,0,18861.23728660345,rap
probably hardest thing ever hear anything harder link wear headphones better experience,9,18864.920619936784,rap
hello mu name cout dropped hate let know think thank,1,19107.220619936783,rap
long think dababy remain popular,0,18882.03728660345,rap
young upcoming artist feedback appreciated,0,19113.90395327012,rap
developing rap skills mobile games,0,18918.05395327012,rap
free nle choppa x splurge type beat fax k upreme x stunna vegas type beat,0,18946.65395327012,rap
free nle choppa x splurge type beat moves k upreme x stunna vegas type beat,0,18946.90395327012,rap
deluxe wishlist,4,19785.50395327012,rap
freestyla xxxtentacion jocelyn flores official instrumental,0,19404.520619936786,rap
question lyrics,4,19185.870619936784,rap
sigsgotthestrap missphizzledotcom prod kydro uncensored sigsadworld pt,0,18998.470619936783,rap
based chloraseptic ii beat,0,19247.93728660345,rap
need help read post,2,19053.45395327012,rap
looking rap song lil dirk,2,19071.25395327012,rap
free lil mosey x gunna type beat cuban prod kalex guitar,0,19080.93728660345,rap
ssjmelo back square one opinions criticism,0,19094.65395327012,rap
underrated canadian artists plz give listen,0,19149.95395327012,rap
life food court heart break ft curtis waters yung star ballout,0,19169.83728660345,rap
gang starr family loyalty feat j cole official video,1,19196.50395327012,rap
person like listening leaked songs prefer waiting till artists album drops single listen track,15,20648.270619936786,rap
