title,comments,age,thread
frank maury sticky,0,19216.570619936785,rap
created something find people music interests,0,19270.070619936785,rap
rap video chile rap chileno,0,19286.570619936785,rap
alone sad acoustic guitar beat prod unknwn,4,19302.90395327012,rap
video history lil uzi vert rap related,0,19337.30395327012,rap
san francisco california freestyle rap,1,19393.720619936783,rap
whats yall dropped new track would really appreciate yall gave listen much love,4,20045.370619936784,rap
spanish vibes beat feel free use non profit,0,19448.70395327012,rap
coward hiphop,4,19548.103953270118,rap
check video slick rick,1,19911.90395327012,rap
lamn,2,19560.170619936784,rap
feedback,0,19629.103953270118,rap
free nle choppa x splurge type beat moves k upreme x stunna vegas type beat,0,19632.33728660345,rap
san francisco blowing biscotti,0,19866.68728660345,rap
freestyle minecraft type beat nostalgia prod smoove lillefan li lle fan,0,19659.68728660345,rap
freestyl drake x russ type beat sharp ft logic,0,19674.70395327012,rap
fire freestyle carwash,0,19818.93728660345,rap
guys help write raps,7,19838.520619936786,rap
beat dope,1,20298.63728660345,rap
casisdead,1,19916.50395327012,rap
released new songs display creativity tell think,0,20150.33728660345,rap
rapping alone car white female ofc say n word say instead holding breath,13,19927.720619936783,rap
lowkey catchy hit real quick man lmk,0,19934.520619936786,rap
new song,0,19947.98728660345,rap
gretzky blowing biscotti rap,0,19961.670619936784,rap
found guy ad youtube one album please give listen smoke want chill music beat friend,0,19961.73728660345,rap
zikey uni glockyglocky feat lmall,0,19965.95395327012,rap
finally following dreams wrapping full time guys think,6,19977.08728660345,rap
trying find song,2,20015.05395327012,rap
hot new artist releases two new songs promote project,0,20028.670619936784,rap
opinion overrated rapper,4,20266.03728660345,rap
suave youngin bentley truck,0,20047.93728660345,rap
suggestions playlists,4,20059.88728660345,rap
sprinkle dream prod calebtheprodigy feedback beat wavy rap,0,20077.80395327012,rap
san francisco california freestyle rap,0,20084.620619936784,rap
rate friends rap,5,20183.870619936784,rap
lil tjay f n autotune genius interview,0,20203.520619936786,rap
need start rapping,5,20207.40395327012,rap
looking songs workout,3,20214.15395327012,rap
made new lyrics lemme know think,13,20582.88728660345,rap
g bump rq u w n regret u sadb,0,20230.75395327012,rap
yung bans sure ft young deluxe,0,20250.03728660345,rap
marzo catch vibe prod z major official music video,0,20277.970619936783,rap
spiritual val verrel body,0,20285.13728660345,rap
rapanoname ft marley retro speed,0,20319.170619936784,rap
juice self aware,0,20332.020619936786,rap
new banger rap song hermosa check tell ur opinions,0,20344.40395327012,rap
lil clipz gungaginga,1,20406.770619936786,rap
free nle choppa x splurge type beat moves k upreme x stunna vegas type beat,0,20441.520619936786,rap
dark banger rap trap beat prod eth beats,0,20491.070619936785,rap
back square one prod ssj opinions criticism,0,20492.970619936783,rap
san francisco california blowing biscotti rap,0,20520.88728660345,rap
trying make dope ass lyric video mine reach fans got deleted r eminem,0,20775.170619936784,rap
c street hot freestyle,0,20565.73728660345,rap
got lyrics people,2,20566.020619936786,rap
free jid x dreamville type beat lately,0,20632.43728660345,rap
free nle choppa x splurge type beat fax k upreme x stunna vegas type beat,0,20639.070619936785,rap
senior quote need help,4,20640.520619936786,rap
coming j ac k,0,20645.770619936786,rap
coming j ac k,0,20645.88728660345,rap
san francisco california blowing biscotti rap,0,20669.920619936784,rap
need honest opinon,0,20698.65395327012,rap
opinions,0,20700.603953270118,rap
free waterlight lo fi type mac miller tpye beat prod cozy billi,0,20711.620619936784,rap
dree low pippi,1,20716.40395327012,rap
naboiiu ttg,0,20716.73728660345,rap
anyone know good subreddit rating rap lyrics,0,20718.18728660345,rap
xcloudzx chronic problems rap hiphop,1,20779.720619936783,rap
ix ine snitch,0,20443.95395327012,rap
numbfreezer gone good,0,20820.93728660345,rap
looking help grow going quit back breaking job today look something better building craft,2,20825.50395327012,rap
gucci gang remix,0,20829.670619936784,rap
first single let know think,45,22280.203953270124,rap
go check music,0,20933.670619936784,rap
drake x joyner lucas type beat hit hit,0,20947.30395327012,rap
free tay keith x blocboy jb type beat rover ft savage rap trap instrumental,0,21063.68728660345,rap
best rapper right,0,21070.470619936783,rap
rap contest help needed,0,21465.18728660345,rap
hold cup rate shit,4,21114.90395327012,rap
shot first music video ever new single check critique welcome,0,21115.90395327012,rap
american rap vs russian rap,0,21359.070619936785,rap
beat chill,0,21404.63728660345,rap
favorite rapper u,3,21196.95395327012,rap
first ever lyrics,0,21210.55395327012,rap
free beat rappers say ruthless,2,21667.020619936786,rap
san francisco california freestyle,0,21311.670619936784,rap
check channel,0,21312.90395327012,rap
discussion french montana good artist,1,21370.270619936786,rap
need advice getting flow achieving right sound voice w beat open minded,0,21375.95395327012,rap
recommendations,2,21417.83728660345,rap
gathering juggalos faygo armageddon furniture trash fire,1,21423.98728660345,rap
meme rappers,12,21444.45395327012,rap
san francisco california freestyle,0,21449.93728660345,rap
u sum bitches merched,0,21453.920619936784,rap
celebrities still following tekashi instagram,0,21485.320619936785,rap
need,0,21497.05395327012,rap
new song found fire,0,21505.83728660345,rap
jason price long island brooklyn remix,0,21526.50395327012,rap
everything foreign,0,21528.65395327012,rap
go ivy league university drop pursue rapping please watch video answer comments,5,21582.353953270118,rap
case wanted peep dope shit today,0,21607.720619936783,rap
let know think blue alsa lie,0,21621.63728660345,rap
first recorded song,0,21644.320619936785,rap
eth beats imperfections instrumental beat,1,21872.28728660345,rap
,0,21648.28728660345,rap
roger repeat found reach great prod yungdnny youtube soundcloud hmm,0,21661.220619936783,rap
trick,2,21681.75395327012,rap
gretzky big bank,0,21701.75395327012,rap
looking edit music video,0,21722.520619936786,rap
san francsico california freestyle,0,21723.93728660345,rap
first ever rap song,5,21735.720619936783,rap
made song wanna get people im btw dont roast,8,21741.33728660345,rap
dababy x ski mask slump god x offset type beat playin,0,22013.770619936782,rap
free nle choppa x splurge type beat stacks stunna vegas type beat,0,21789.68728660345,rap
anybody free time,2,21803.120619936784,rap
hardest lil durk songs,4,21809.73728660345,rap
nba youngboy house arrest tingz,0,21826.220619936783,rap
free tay keith x blocboy jb type beat rover ft savage rap trap instrumental,0,21849.070619936785,rap
like someone mentor lyrics,0,21872.25395327012,rap
meme one lets freestyle asap mob,1,22098.80395327012,rap
need reccomendations,11,21889.65395327012,rap
dark fame future x young thug type beat hard trap beat prod imperiumbeatz,0,21908.920619936784,rap
hudacek cringe wit official music video,0,21910.38728660345,rap
free jid x j cole type beat battle free instrumental rap trap beat,6,22276.30395327012,rap
juice wrld x iann dior type beat sweettooth prod xander,0,21922.370619936784,rap
dababy security responds punching female,0,21926.03728660345,rap
donnie waters loose ends,0,21927.020619936786,rap
good bad dumb dumbfounding drake lyric fucked,4,21947.28728660345,rap
lil mosey baby face upvote agree,29,23559.78728660345,rap
discussion french montana underrated,1,21983.13728660345,rap
kid makes homophobic freestyle,1,21984.95395327012,rap
free big bro travis scott x migos type beat flute type beat,0,21988.40395327012,rap
rate would rank flow best,0,22007.703953270124,rap
san francisco california bity bank freestyle,0,22008.88728660345,rap
ssjmelo back square one opinions criticisms would appreciated,0,22024.003953270123,rap
alternative conscious rap looking honest feedback constructive criticism regarding latest single,2,22042.437286603454,rap
listen like share please,0,22043.83728660345,rap
san francisco california freestyle rap,0,22048.78728660345,rap
weekly r rap coming artists thread post favorite underground artists even,5,22299.60395327012,rap
san francisco california freestyle rap,0,22075.55395327012,rap
know whether writing done rap poem,2,22096.220619936783,rap
new song really want give listen let know think thanks,0,22133.30395327012,rap
free tay keith x blocboy jb type beat rover free type beat rap trap instrumental,2,22369.38728660345,rap
hey guys worked truly hard course past year late last year guys give honest feedback would highly appreciated much love,0,22152.503953270123,rap
tropico miami yacine kokaina type beat instrumental hard trap beat instrumental imperiumbeatz,0,22153.770619936782,rap
bandolero elijah yo x biggs,0,22403.920619936784,rap
dababy security responds punching female,0,22207.83728660345,rap
san francisco california freestyle rap,0,22241.60395327012,rap
compton morning dr dre x ice cube type beat west coast beat prod imperiumbeatz,0,22256.237286603453,rap
best beat ever made let know think,2,22277.40395327012,rap
san francisco california freestyle rap,1,22367.770619936782,rap
gretzky big bank,0,22434.753953270123,rap
opinion cover artists designers get enough credit rap game,3,23115.987286603453,rap
waapsi agressive rap work done eskype rapboy,0,22513.30395327012,rap
free tay keith x blocboy jb type beat pull fast trap beat free type beat,0,22518.970619936783,rap
gretzky big bity bank freestyle rap,0,22525.487286603453,rap
pac eminem die soon,0,22659.670619936784,rap
blackbear x bryson tiller x juice wrld type beat broken,3,22917.453953270124,rap
pac overrated,27,22765.82061993678,rap
finished playlist,0,22800.020619936782,rap
