title,comments,age,thread
eminem one breath,45,844.2539532701173,rap
trrewillz got nothin inland empire rap new rap music,1,161.57061993678408,rap
need rapper raw beat made open suggestions,1,163.5206199367841,rap
rap bangers,6,168.57061993678408,rap
one favorite verses j cole verse end logic africaryan decided remix guys think,0,153.38728660345078,rap
love hate relationship rap ya feel,0,18.85395327011744,rap
lethal prod penacho ft nasper allen f,0,33.287286603450774,rap
freestyle boom baby,0,492.5039532701175,rap
ap rocky disses travis scott entire beef backstory,0,54.67061993678411,rap
penguin come rap,0,88.38728660345078,rap
pretty sick freestyle,0,99.27061993678413,rap
beat smooth,0,110.12061993678414,rap
mumble lyrical,8,148.85395327011744,rap
chief keefs two zero one seven album underrated,0,152.73728660345077,rap
life sad jordan wilson prod ninety hertz,0,197.8706199367841,rap
juice wrld fast forward,0,217.1206199367841,rap
ap rocky x travis scott x denzel curry x kendrick lamar x rick ross type beat dying live,0,217.23728660345083,rap
pac eminem roy jones jr good life,0,222.1206199367841,rap
japanese type beat instrumental rap genjutsu,0,230.90395327011746,rap
mjstacks ft mont money ride prod saavane audio,0,264.6539532701174,rap
val verrel body unique,0,283.6206199367841,rap
need help lack better word,3,301.77061993678416,rap
tory lanez x juice wrld type beat joker prod xander,0,316.70395327011744,rap
roadrunner prod peten trip hop beat dream trap instrumental,0,319.25395327011745,rap
new kanye west type beat wants rap,1,546.7539532701173,rap
genre beat,0,342.80395327011746,rap
smokemajor x vilz,0,343.25395327011745,rap
lookin people collab ice factory beats,0,569.3206199367839,rap
san francisco california rap,0,359.2539532701174,rap
hey newer rapper grinding get better trying get music main problem probably tone matching beat good lyrics though mind feedback,0,373.8872866034508,rap
jay stone lines prod colb colbeat productions,0,375.9039532701173,rap
discussion heard ddg think youtube stars turned musicians,0,376.7539532701175,rap
verse faxx,0,397.4372866034508,rap
free travis scott type beat head games free type beat,0,423.9872866034508,rap
yung hade losing interest,0,427.08728660345076,rap
words use replace n word,8,430.9372866034508,rap
free zelda lil keed x lil gotit type beat,0,433.0706199367841,rap
free nba youngboy type beat kidnap trap beat emotional type beat,0,433.9872866034508,rap
slum excuse feat cellphones,0,441.1206199367841,rap
yung hade overthinking,0,444.3706199367841,rap
free nle choppa x dababy type beat opps piano trap beat prod kamikaze,0,449.6206199367841,rap
nym lo rd high horse,0,487.3706199367841,rap
finna rip apart,0,504.6706199367842,rap
brother dropped remix elm street jimmy wopo,0,505.6706199367842,rap
zaybooty upcoming rapper dallas texas think,4,1711.1206199367841,rap
yung hade dancing devil,1,510.02061993678416,rap
jay stone lines prod colb hip hop rap new,0,514.2372866034508,rap
yung hade tired,0,525.2706199367841,rap
jinxself birdbox someone sign guy,1,535.7039532701175,rap
yung hade close full album stream,0,541.6372866034508,rap
good songs check youtube,9,1093.1372866034508,rap
anybody looking emotional beat go free,0,718.6539532701173,rap
woo ha got check,1,1305.2706199367842,rap
looking feedback music guys time listen,3,1110.9039532701174,rap
secret lives chinese rappers atlantic,0,757.370619936784,rap
started writing music idea,0,777.4039532701173,rap
tide kendollog ken doll og free listening soundcloud,0,799.4872866034508,rap
guys think nba youngboy favorite songs,2,1259.3039532701175,rap
drake exposed drake fake beef dad exposed,0,1319.9372866034507,rap
gonna elvis mmudubudu,0,1106.2372866034507,rap
rap name superhero name,16,1917.6539532701172,rap
desiigner mura masa around world remix,0,908.620619936784,rap
eth beats hard sick beat,0,944.5039532701173,rap
yung hade close full album stream,0,1171.1372866034508,rap
free big sean type beat squid smooth rap instrumental best free,2,1598.8206199367844,rap
rager universe rager universe,0,1012.2539532701173,rap
new song peep give feedback,1,1259.503953270117,rap
old school type shit,0,1454.1372866034505,rap
lethal prod penacho ft nasper allen f,0,1123.5206199367842,rap
best underground artist,4,1481.8539532701175,rap
video editor looking practice,0,1385.9039532701174,rap
anyone tell first song please,0,1170.9872866034507,rap
san francisco california,0,1182.4372866034507,rap
produce full time work artist clients every day separates ones kill ones suck,0,1878.5372866034506,rap
top miami rappers new perspective sound miami rap,1,1259.3039532701175,rap
made rap little ceasers n stuff,0,1548.3206199367844,rap
petey pesto hard dms official video,1,1701.5872866034506,rap
think beastie boys objectively good rapping,5,1712.3872866034505,rap
free nle choppa x dababy type beat raid stunna vegas type beat freestyle beat,6,2138.920619936784,rap
scam rap taking teejayx guapdad,0,1606.6039532701175,rap
trippie redd x juice wrld type beat tried,0,1625.3872866034505,rap
many trying hip hop career,2,1643.720619936784,rap
lil yatchy makes feel physically ill,1,1262.9539532701174,rap
weekly r rap coming artists thread post favorite underground artists even,7,2139.2039532701174,rap
newest album please give listen,9,2627.537286603451,rap
christian rap next phase kanye,1,2352.2539532701176,rap
eth beats often sick banger,1,1912.8039532701173,rap
ab rap duo massachusetts,1,1586.1039532701175,rap
san francisco california,0,1588.220619936784,rap
feel hollow inside,0,2049.187286603451,rap
professional mix mastering service,0,2078.370619936784,rap
jesus christ ni church youth outreach program rap song,1,1676.7706199367844,rap
btitish help please tl dr british influences,0,1688.0706199367844,rap
found rapper randomly actually deleted older songs still find im posting loved song maybe also one songs also like called zero leave light give try sounds like eminem,1,1689.6872866034507,rap
quirt gun anal,0,1708.0872866034506,rap
lil tecca fan,0,1949.3039532701173,rap
one best lyricists ever heard,2,2271.820619936784,rap
free producer looking rappers singers,2,1755.7872866034506,rap
ask tse,0,1993.9039532701172,rap
rorshank helene ekra,1,1775.1039532701175,rap
lil nas x juice wrld type beat cowgirl prod xander,0,1783.5206199367844,rap
discussion da baby lil baby,0,1816.0372866034506,rap
released prelude forthcoming album critique,0,1824.9039532701172,rap
anthony wall rap featuring little rap guy friends,0,2056.920619936784,rap
free travis scott x metro boomin type beat stranger free trap beats rap trap instrumental,0,1836.3872866034505,rap
new old rapper,0,2197.5872866034506,rap
pavlo szukam si,0,2098.9706199367843,rap
sensitive low bpm trap beat roses jony,1,1886.3872866034505,rap
buddy barz tindah mash fire beat creative flow lyrics,0,1891.670619936784,rap
stream new song,0,2129.037286603451,rap
check plz works hard hope good,0,2143.0539532701173,rap
top time list,2,1952.6372866034505,rap
name video vixen blonde,0,2325.4039532701177,rap
drug abuse,0,2364.687286603451,rap
gretzky rap,0,2017.8039532701173,rap
give back everyone supported untagged free profit joint yall thank much,0,2492.787286603451,rap
hyper critical grizzly mind,0,2321.620619936784,rap
hateful words acceptable,1,2148.287286603451,rap
let know think song working,17,2689.320619936784,rap
wilson interlude pedro,0,2270.953953270117,rap
eth beats often sick banger,1,2547.487286603451,rap
want share favorite rap country poland,9,3621.9539532701174,rap
hey guys old rapper las vegas id really appreciate feedback new single,2,2520.353953270117,rap
u agree,0,2551.103953270117,rap
share new rap song waiting support,6,2940.387286603451,rap
taste tyga remix tupac,1,2609.187286603451,rap
let know think song writing,3,2634.603953270117,rap
spitty kick door,2,2920.670619936784,rap
c silver things said prod discent,1,3253.9039532701177,rap
breana marin ft smokemajor,0,3095.237286603451,rap
representing fresno ca check beats,2,2754.670619936784,rap
dababy x comethazine type beat yall think clip bronx tale,2,3284.020619936784,rap
gary washington forgiveness prod kontrabandz official video,1,3261.187286603451,rap
gretzky rap,1,2904.58728660345,rap
hello make beats vibe feel free listen story life prod demented,2,2907.487286603451,rap
nf,27,4006.270619936784,rap
professional mix mastering service,0,2922.887286603451,rap
sunday inspiration,2,2941.537286603451,rap
gretzky rap,0,2955.487286603451,rap
nearing album defined decade,1,2987.987286603451,rap
sea side niggas love like gun rap album,1,3011.670619936784,rap
hand florida found fire,2,3015.2039532701174,rap
free ix ine type beat bruh hard trap beat instrumental best fre,2,3026.3039532701173,rap
tips blow tiktok,0,3493.2206199367847,rap
lucki type beat back prod betwixt,0,3048.237286603451,rap
possibly hardest single unsigned artist,0,3068.937286603451,rap
everyone follow soundcloud,0,3092.370619936784,rap
looking make playlist,10,3450.737286603451,rap
big harley prod yondo official video,0,3095.370619936784,rap
damian lillard vs shaq diss track battle,1,3359.737286603451,rap
cypher lio rush briana brandy josiah williams,0,3147.737286603451,rap
free nle choppa x dababy type beat raid stunna vegas type beat freestyle beat,0,3158.4706199367847,rap
emo rap banger,0,3165.537286603451,rap
boom bap beat chill,0,3176.3039532701173,rap
new rapper calling rakim,0,3188.503953270118,rap
french hip hop rnb zayra enfant du milieu,0,3200.637286603451,rap
new music video youtube type jefe yo soy finesse subscribe music videos share music soundcloud soundcloudrapper soundcloudrap soundcloudrappers soundcloudartist soundcloudmusic raplatino rapartist rapbeat trapmusic rapfrancais rapitaliano rapm,0,3201.9706199367847,rap
anthony wall timeless sep rap video little rap guy friends,0,3224.83728660345,rap
dark fame future x young thug type beat hard trap beat prod imperiumbeatz,0,3472.2039532701174,rap
new songs like nothing heard,3,3615.770619936784,rap
lil tecca x gunna type beat pushing,0,3485.287286603451,rap
top rappers west coast,3,3530.6539532701177,rap
tonight drake presents gretzky rap,0,3582.7206199367847,rap
gio weitermachen prod rush,0,3372.4039532701177,rap
free roddy ricch x lil baby type beat emotions polo g type beat free type beat piano,0,3606.437286603451,rap
seeking rappers features,5,4069.1539532701177,rap
jeprdy sonata,0,3634.137286603451,rap
would jot beat,0,3771.103953270118,rap
til always rap fan never knew male duck called drake,5,4707.120619936784,rap
wiley ft devlin holy grime bring,0,3720.9706199367843,rap
mean,14,3956.670619936784,rap
first freestyle hope like,0,3964.9039532701177,rap
compton rap,1,3763.387286603451,rap
help,0,3810.820619936784,rap
sky fall,0,3835.270619936784,rap
rain know hiphop,0,3835.270619936784,rap
k n,2,3958.570619936784,rap
good rapper name,28,4721.253953270118,rap
collab,4,4201.570619936784,rap
clout chasing disorder,0,3979.4706199367843,rap
new album lil kim,1,4774.753953270118,rap
trrewillz got nothin best new artist best new rap songs,0,4032.4872866034502,rap
ppl improve voice control pitch,4,4491.0372866034495,rap
small town friend grew making music thought share since like even makes spanish music produces tracks co produces friend sometimes,1,4785.253953270118,rap
domani harris thoughts dude,0,4341.353953270117,rap
need rap name,27,4821.720619936784,rap
wiley da bloodclart morning,0,4534.637286603451,rap
zelooperz jayjay z video thoughts,2,4763.920619936785,rap
free nle choppa x dababy type beat snap stunna vegas type beat freestyle beat,0,4497.837286603451,rap
underground rapper,1,4285.487286603451,rap
original adeyeme koopa freestyle,0,4296.170619936785,rap
little dipper good rapper name,2,4299.270619936784,rap
gretzky takealook mafia,0,4327.303953270118,rap
tell think please pressure moonie,6,4331.653953270117,rap
freestyle rap,19,5488.303953270118,rap
british help,0,4807.2872866034495,rap
bekahboo affirmations,0,4839.720619936784,rap
kkev x teejayx forza,0,4430.303953270118,rap
kilo ali fayrothedon tour atlanta,0,4449.753953270118,rap
smokemajor lyrical talent,0,4680.420619936785,rap
released new song called flow looking feedback,0,4702.120619936784,rap
gretzky rap,0,4520.303953270118,rap
check year old brooklyn young boogie sound next generation rap going bring something special game much like th generation brought unique use autotune haters call mumble rap,4,4560.670619936785,rap
ssjmelo back square one opinions,0,4578.420619936785,rap
dikembe love mp go marcus paige,0,4580.937286603451,rap
free lil uzi vert x ynw melly type beat sunbeam prod evan beatz x david fourth,0,4821.353953270117,rap
check stuff thing made,0,4823.220619936784,rap
anyone kept cent ja rule beef really cappin video attached,0,4599.703953270117,rap
sym neisdead la di da di prod klimonglue,0,4600.487286603451,rap
tory lanez x killy type beat spacemen prod xander,0,4633.637286603451,rap
looking producer,7,5408.070619936784,rap
compton morning ice cube type beat dr dre type beat west coast type beat prod imperiumbeatz,0,4659.020619936784,rap
check soundcloud,0,4665.937286603451,rap
new album ron gilmore l k n g,0,4674.137286603451,rap
beat soulful,0,4686.570619936784,rap
looking artist interested throwing hooks chorus work next song latest track show voice please hmu send beat first verse new one,0,4715.853953270117,rap
new album ocean wisdom big talk vol,0,4716.003953270118,rap
listen new beats mixed emotions lil souncloud,0,4947.520619936784,rap
need feedback,0,4840.487286603451,rap
mac miller sound,0,4850.203953270117,rap
holy shit ha,1,5078.437286603451,rap
san francisco california rap,0,4897.403953270117,rap
snoop dogg wanna thank,0,4943.437286603451,rap
elfrenchiesmok rap hiphop,0,5198.553953270118,rap
professional mix mastering service,0,5015.570619936784,rap
dead heat run,0,5058.887286603451,rap
ssgkobe roddy ricch prod kylejunior,0,5083.2872866034495,rap
rhymes yay nay,20,6132.153953270117,rap
yo guys dropped music video new song anyone got bit spare time bit feedback wanna know improve well thanks,2,5717.887286603451,rap
hits harder drunk dad,0,5731.7872866034495,rap
gretzky rap,0,5289.203953270117,rap
gretzky rap,0,5663.9206199367845,rap
kaseek ortiz feelin hiphop,0,5396.803953270118,rap
top rappers opinion rough list,18,5416.0372866034495,rap
sad fucking fire,1,5209.753953270118,rap
thought might appreciated,4,6565.470619936784,rap
gretzky rap,1,5708.9206199367845,rap
tekashi explainer contract great appears american drool,0,5854.520619936783,rap
constructive criticism,8,5881.203953270117,rap
legendary cyphers week season live hiphop union square nyc,0,5882.0039532701185,rap
fresh malik yanis p,0,5751.553953270119,rap
top greatest rapper tine,18,5755.237286603451,rap
random song,0,5532.5372866034495,rap
ssjmelo back square one opinions,2,5990.303953270119,rap
need beats hungry producer flip samples food,0,5908.120619936783,rap
check battle share,0,5553.403953270117,rap
rappers,6,5602.987286603451,rap
free nle choppa x dababy type beat snap stunna vegas type beat freestyle beat,0,5629.687286603451,rap
ratings,0,5653.470619936784,rap
fresh sylence prosper,0,5879.953953270117,rap
unotheactavist fear death,0,5929.903953270117,rap
sidhu moose wala x mist x steel banglez x stefflon official video,0,5978.370619936783,rap
lets check new type beat,0,5812.7872866034495,rap
need warm music,1,5825.803953270119,rap
songs blow tiktok,0,5855.637286603451,rap
hey guys wale dropped new album review everyone else thoughts,2,6579.737286603451,rap
ix ine signs million dollar record deal prison snitching myth,28,7178.2872866034495,rap
beat smooth,0,5963.1706199367845,rap
tired following society,1,6424.837286603451,rap
let know think song released,2,6209.703953270117,rap
free savage x drake type beat set free trap beats rap trap instrumental,0,6005.903953270117,rap
worry ok listen music,0,6036.887286603451,rap
free dababy x stunna vegas type beat rpg da baby instrumental hard trap beat,0,6045.0039532701185,rap
homie made first music video tell think,1,6045.487286603451,rap
gretzky rap,0,6052.653953270117,rap
looneythalostkidd,0,6067.153953270117,rap
juice wrld use auto tune mic shows,1,6067.870619936783,rap
free nle choppa x splurge type beat moves k upreme x stunna vegas type beat,0,6104.153953270117,rap
friend mizzle making music years hope would support journey,0,6122.020619936783,rap
val verrel awakening power hip hop video,0,6350.187286603451,rap
kouru energy,0,6128.637286603451,rap
reaction,0,6129.570619936783,rap
good missing,1,6209.703953270117,rap
free beats,4,6247.1706199367845,rap
guess make better beats sober,9,7555.487286603451,rap
want start rapping know nothing beats rhythm begin,3,6280.203953270117,rap
add,2,6293.620619936783,rap
svenne cypher sekenseek,0,6332.687286603451,rap
help writing disstrack,1,6364.837286603451,rap
soundcloud underground meme rappers post links,1,6430.053953270119,rap
eminem worst ft weekend,0,6476.587286603451,rap
russ x j cole x g eazy x j x mac miller type beat sounds guns,5,6557.803953270119,rap
heavii metal moonwalker lofi trap,2,7099.403953270117,rap
moan moaning official video,1,6667.1706199367845,rap
project x big drew free listening soundcloud,0,6743.687286603451,rap
got time go check please thanks,2,7071.837286603451,rap
juan love,0,6918.620619936783,rap
edm rap technological singularity,0,6924.570619936783,rap
help,0,6936.320619936783,rap
beat hard,0,6960.603953270117,rap
cam ron ft juelz santana oh boy,2,7649.0372866034495,rap
got banned need karma wrote rap get back,0,6985.803953270119,rap
moneybagg yo megan thee stallion dat official music video,1,7038.870619936783,rap
first beat ever released,0,7080.953953270117,rap
year old rapper trying live dream anyone wanna link,45,8312.270619936784,rap
gretzky rap,1,7128.803953270119,rap
free dababy x stunna vegas type beat rpg da baby instrumental hard trap beat,0,7490.420619936784,rap
oldie pimp juice check,0,7134.0372866034495,rap
lil uzi vert cartel prod deko,0,7150.887286603451,rap
ayeee peep new song addied slapps,0,7160.637286603451,rap
beste,0,7171.020619936783,rap
humour ice cube version vanilla ice pressure say ice ice ice baby,2,7545.070619936783,rap
nick prosper beautiful day,0,7477.137286603451,rap
adeyeme run,0,7265.053953270119,rap
smokemajor flowing,1,7271.620619936783,rap
ix ine bigger snitching million dollar deal jail,0,7286.137286603451,rap
webeuntitled moni goth hip hop,0,7325.5372866034495,rap
hours beats looking artists work develop,0,7565.737286603451,rap
top atlanta rappers list debate,0,7340.5039532701185,rap
ayeee check new song addied shit slappss,2,7352.203953270117,rap
made free beat within hours kid blew away,2,7382.437286603451,rap
lil clipz gungaginga,0,7430.353953270117,rap
video much,0,7453.453953270117,rap
chief keefs craziest show,0,7453.703953270117,rap
pink guy onichi,0,7473.803953270119,rap
tonight drake presents gretzky rap,0,7474.337286603451,rap
lil poppa x lil keed type beat nova prod xander,0,7514.570619936783,rap
latest song let know think thank,2,7778.5039532701185,rap
free smooth guitar type beat fancy prod kalex juice wrld type,0,7557.770619936783,rap
stanley odd marriage counselling scottish,0,7574.453953270117,rap
analyzing lyrics gettin use living human life may sound stupid human human like skin glow dark safe move night sometimes eyes turn black pale moonlight think means,1,7575.0372866034495,rap
free nle choppa x dababy type beat shoot da baby instrumental stunna vegas type beat,0,7591.103953270117,rap
duane jackson vs dzk,0,7839.737286603451,rap
years ago friend talked suicide decided write little freestyle birthday next week feedback would awesome,3,7629.937286603451,rap
pranav world first letters rap song ever beatbox,0,7633.7872866034495,rap
playboi carti x lil skies going back type beat yall think,0,7649.387286603451,rap
gangsta rapper,12,8175.987286603451,rap
someone wants rap lyrics,5,7691.237286603451,rap
gretzky rap,0,7701.120619936783,rap
first verse guys think type flow could work trap beats,0,7742.770619936783,rap
rickdagreativ lava ft dougie allen prod colb colbeat productions,0,7748.803953270119,rap
free valee x splurge type beat slide k upreme x chasethemoney type beat,0,7750.170619936784,rap
rap verses without instrumentals,1,7803.553953270119,rap
similar songs,0,7809.053953270119,rap
claudie b feat nle choppa pocket hiphop,0,7817.187286603451,rap
edesa elemental,0,7824.470619936784,rap
gretzky rap,0,7834.520619936783,rap
nf x logic x joyner lucas type beat seized,2,7987.2539532701185,rap
gretzky speak rap,0,8010.203953270117,rap
need helping finding old school gangster rap,15,9032.237286603453,rap
ix ine,3,8033.0039532701185,rap
san francisco california rap,0,8049.270619936783,rap
smokemajor major season,2,8720.703953270118,rap
gretzky rap,0,8211.020619936784,rap
gretzky rap,0,8249.720619936785,rap
remixed silvia miike snow song wrote fiance,0,8326.053953270117,rap
got attention randoms twitter best song date,0,8565.28728660345,rap
thing made,4,8609.103953270118,rap
feat,0,8387.420619936784,rap
penguin ft nightbreed law abiding citizen rap,0,8395.737286603451,rap
aluan e dopo questa ciao,1,8682.087286603452,rap
free nle choppa x dababy type beat shoot da baby instrumental stunna vegas type beat,3,8706.553953270117,rap
diamonds vvs,0,8511.520619936784,rap
help,14,9632.18728660345,rap
want get rap music listen,8,8555.137286603449,rap
suggestions songs,2,8567.620619936784,rap
close yung hade,0,8570.703953270118,rap
gretzky rap,0,8584.603953270118,rap
super chill beat,0,8591.637286603449,rap
name song artist,1,8622.070619936783,rap
beat sick hard banger,0,8852.370619936784,rap
free drake x russ type beat offer,0,8653.153953270117,rap
rap instrumentals sure tickle fancy,0,8664.570619936783,rap
colb,1,9262.770619936784,rap
check new shit,1,9264.503953270118,rap
drake presents gretzky rap,0,8691.520619936784,rap
need beat rap willing pay good work projects,3,8692.653953270117,rap
gretzky rap,0,8701.853953270118,rap
monotone need get,2,8703.28728660345,rap
songs cringey lol lyrics people say missing rap style basic simple people love stupid stuff like know sound terrible yrs ago recorded c e p know anything prod,1,8723.987286603451,rap
eth beats motivation sick beat,1,8954.053953270117,rap
amateur cover mac miller funk flex freestyle,0,8735.03728660345,rap
music video,0,8966.353953270118,rap
recommendations,3,8771.737286603451,rap
gretzky rap,0,8772.003953270118,rap
hip hop news ig pages must stopped roast,0,8783.820619936783,rap
th power entertainment fall release calendar tour dates,0,8786.520619936784,rap
good raping,17,8806.220619936785,rap
one thinks dababy dj annoying,1,9374.153953270115,rap
great dirty south jam buddies find internet anywhere years one favorite songs era hope yinz appreciate much,0,8854.18728660345,rap
kartik danda got prod rmk,0,8854.753953270118,rap
phaze jones unpopular opinion new hip hop,1,8859.253953270118,rap
boys playlist needs help,2,8862.18728660345,rap
accapella freestyle rap,1,8862.270619936784,rap
gretzky rap,0,8870.18728660345,rap
first time uploading one instrumentals onto reddit,0,8897.153953270117,rap
drake presents gretzky rap,0,8920.903953270117,rap
free nle choppa x dababy type beat shoot da baby instrumental stunna vegas type beat,0,8926.153953270117,rap
travis scott x lil durk type beat alpine prod xander,0,8947.020619936784,rap
ssjmelo back square one opinions,0,8983.720619936785,rap
murky waterzz brothers hip hop audio,0,9110.170619936784,rap
pra quem curte uma boa vis,0,9149.887286603449,rap
travis vibes lit sh,1,9221.553953270117,rap
lil clipz gungaginga,1,9221.870619936784,rap
white swedish rapper air pods english destroy make cry please,1,9304.720619936783,rap
help rap country lyrics,9,10164.003953270118,rap
san francisco california,0,9334.870619936784,rap
mc syndrom criminal devils,0,9352.570619936783,rap
look tha similarities,0,9653.487286603453,rap
san francisco california,0,10063.78728660345,rap
song rap recent project,0,9484.887286603449,rap
roddy richh die young,7,10209.03728660345,rap
posted already one seen lol,0,9763.487286603453,rap
pt rocky free listening soundcloud,0,9553.953953270118,rap
free dismal type beat milli tpye beat,0,9557.553953270117,rap
kendrick lamar leaving rap,7,9584.253953270118,rap
yo check new song addied fire afff,0,9602.120619936784,rap
check newest song,0,9606.353953270118,rap
new youtube channel went live gave honest review riff raff sub pls,0,9679.653953270115,rap
flights,0,9707.587286603452,rap
question grills,18,10385.920619936784,rap
eminem vs drake imaginary beef would win,8,9788.887286603449,rap
succession pusha remix,0,9805.43728660345,rap
free nle choppa x dababy type beat shoot da baby instrumental stunna vegas type beat,2,10165.237286603453,rap
e p,2,10349.003953270118,rap
writing chorus,1,9833.553953270117,rap
free ambient trap type beat splash prod kalex,2,10210.18728660345,rap
san francisco california,0,9852.587286603452,rap
check newest trash u dont care making u look moist beat,0,9899.637286603449,rap
recommendations,24,10536.803953270117,rap
dice hades living,0,10169.903953270115,rap
guys write raps writing process,36,10792.587286603452,rap
c note instrumental malo smith,0,9959.853953270118,rap
worked hard mixtape year best friend last year high school produced friend written performed mixed mastered working new stuff moment thanks listening let know think,13,10754.087286603452,rap
jordan peterson art sucking dick,7,10998.070619936785,rap
alpha news mn diss track,1,10481.837286603452,rap
val verrel lightbody spiritual,0,10095.120619936784,rap
yung hade superman death official music video,2,9894.203953270118,rap
yunggoth love hurts,0,10356.93728660345,rap
yung pinch x lil skies type beat,0,10140.203953270118,rap
mr e zeo konscience supernova sitting song felt deserved music video hit miss,0,10160.653953270115,rap
ransom freestyle lil tecca cover,0,10218.220619936783,rap
bands rap fans,1,10244.920619936784,rap
travis scott type beat disturbance,0,10251.620619936784,rap
